description,start_time,end_time,transcript
Leisure Activities,222,375," Camera up there this one works. Got set up the same way. Okay. So, one here. And one there. Are we ready? Yeah. Mine has not enough power. power. Seriously? Oh yeah that happens, it's not the case, I think it's not true. I'll probably try another battery pack. Everyone is so quick in here, like one minute. So Kaper, do you have a hair dryer? No. No. Also, I don't. I have hairspray. No, no, it's okay. I have gel. I have gel. That's okay. It has to be more, right? Do you need shower gel? We bought extra shower gels. No, no, no, absolutely not. I'm fine. I was just wondering. Okay. It's just my room doesn not have one. No, my room doesn't have one. Okay. Okay, so we're press for the top ones, right? How do you press? At the top ones, at the side ones, the side turns on. Till it turns on. And then? And then it says not enough power. That's okay. Now press go. And now I'm right here, right? You don't have to change the time, right? That's not going anywhere, is it? No. Okay, you're on now. Okay. Maybe you're looking a little bit too far down. We can start after you leave. Yes. Yes, of course. Okay. Okay. Okay. Okay. Okay. Okay. Okay. Okay. Okay. Okay. Okay. Okay. Okay. Okay. Okay. Maybe you're looking a bit too far down."
Walking,375,560," There's a mirror somewhere. We should put it at the keyhole. I know. The IKEA mirror. Okay, I know. It's really beautiful. It's very important. For the success of this operation, we need operation. Not the sausage ass. You need to tap for the back screen. Where's the fridge? This side. You want to see the fridge?"
"The classification for this segment is **Walking**. 
The person in the image is captured in motion, walking towards the door.",560,580,
Sitting,580,832," Let's see the social gifts. Yes. So, we're going to start with this. No, no, no, no, no, no, no, no, no, no, no, no, no, no, no, no, no, no, no, no, no, no, no, no, no, no, no, no, no, no, no, no, no, no, no, no, no, no, no, no, no, no, no, no, no, no, no, no, no, no, no, no, no, no, no, no, no, no, no, no, no, no, no, no, no, no, no, no, no, no, no, no, no, no, no, no, no, no, no, no, no, no, no, no, no, no, no, no, no, no, no, no, no, no, no, no, no, no, no, no, no, no, no, no, no, no, no, no, no, no, no, no, no, no, no, no, no, no, no, no, no, no, no, no, no, no, no, no, no, no, no, no, no, no, no, no, no, no, no, no, no, no, no, no, no, no, no, no, no, no, no, no, no, no, no, no, no, no, no, no, no, no, no, no, no, no, no, no, no, no, no, no, no, no, no, no, no, no, no, no, no, no, no, no, no, no, no, no, no, no, no, no, no, no, no, no, no, no, no, no, no, no, no, no, no, no, no, no, no, no, no, no, no, no, no, no, no, no, no, no, no, no, Okay. So that's fine. I have a bunch of state cards. I have a bunch of state cards. Yeah, you can come over here. This is for me. This is for me. And this. Yeah, that's why I have a number. 24-star case. Oh, wait, wait. I took it yesterday, so now we're going to pay. No. Oh. Yes. I have to change OK? Don't we have light for more covers? I think we told them we don't have any."
**Leisure Activities**,832,1070," Let me show you something. Hi, how are you? Thank you. Hold the wire and just a little switch. Right. Good. Good. Thanks. Thanks. Thanks. Thanks. Thanks. Thanks. Why don't you just run it over to the other side? Because I want to mix with the extra. You can do that. It's all happening. It's all happening. You do all of that. Yeah. So you do all of that. Right. Right. Yeah. Right. Yeah. Yeah. Yeah. Yeah. Yeah. Right. Right. Right. All of it. All of it. All of it. Yeah. Yeah. Yeah. Yeah. Yeah. Yeah. Yeah. Yeah. Yeah. Yeah. Yeah. Yeah. Okay. I like my house. Who's talking Saturday? I am. We were... What happened today? The lady is finishing her... She's finishing her sportswear. Yeah, that's why I asked. The lady is doing it. We will be asking. We will be asking. We will be asking. We will be asking. We will be asking. We will be asking. Thank you. more water Yes. Old? Yes. Okay. Oh, we have one. Okay. Whisk, whisk. Okay, okay, okay. It makes very good. Yeah, mixer also. There is also a mixer. Okay, that's what we're offering you. We actually have to fill them at once. They probably need to wash first. What do they need? I think they need to use the last bit. So did we say thatella. Meillä on kruudella. Meillä on kruudella. Meillä on kruudella. Ehkä tarvitaan jotain... Ehkä tarvitaan jotain kappia. Ehkä tarvitaan jotain kappia. Minulla ei ole kruudella. Minä olen... Hän ol out looking for a shop. It works. I think we can go after where that gentleman made the coffee. But I have food. But I have a bit proper espresso, not this type of coffee. Do we have a pot of tea, or not? I mean, we have a pot of mushrooms. I've never seen frozen mushrooms. I've never seen frozen mushrooms. I've never seen frozen mushrooms. I've never seen frozen mushrooms. I've never seen frozen mushrooms. I've never seen frozen mushrooms. I've never seen frozen mushrooms. I've never seen frozen mushrooms. I've never seen frozen mushrooms. I've never seen frozen mushrooms. I've never seen frozen mushrooms. I don't get we should have one. Hey, guys, guys. I think we need to put one of these chefs."
Walking,1070,1079," Thank you. Thank you. Thank you. Thank you. Thank you. Thank you. Thank you. Thank you. Thank you. Thank you. Thank you. Thank you. Thank you. Thank you. Thank you. Thank you. Thank you. Thank you. Thank you. Thank you. Thank you. Thank you. Thank you. Thank you. Thank you. Thank you. Thank you. Thank you. I'm not a basic chef, but... Hang on, is everybody's camera flashing red. Is everybody actually on? Yeah. Jordan, can you help me so we can have a look at the big adaptation? On the feet? Yes. This one has just the front buttons. Front buttons. Oh. Okay. Good God. This is, this is, this is... My GoPro tells me this battery is not enough for the camera. Yeah, I enough power? Not enough power. It does that sometimes. Okay. Just try again. Oh yeah, I'm trying. Yeah, it does that sometimes. It is not very consistent in its behavior. I suppose you don't pay these, no? No. You don't pay what? You don't pay your subsidies. Please, only stand up and take notes. We take your notes. They will always go up higher than you. Thank you. Thank you. Should we have 4K on the download? Or should it not be a 4K on WC?"
Leisure Activities,1079,1683," Thank you. Thank you. Thank you. Thank you. Thank you. Thank you. Thank you. Thank you. Thank you. Thank you. Thank you. Thank you. Thank you. Thank you. Thank you. Thank you. Thank you. Thank you. Thank you. Thank you. Thank you. Thank you. Thank you. Thank you. Thank you. Thank you. Thank you. Thank you. I'm not a basic chef, but... Hang on, is everybody's camera flashing red. Is everybody actually on? Yeah. Jordan, can you help me so we can have a look at the big adaptation? On the feet? Yes. This one has just the front buttons. Front buttons. Oh. Okay. Good God. This is, this is, this is... My GoPro tells me this battery is not enough for the camera. Yeah, I enough power? Not enough power. It does that sometimes. Okay. Just try again. Oh yeah, I'm trying. Yeah, it does that sometimes. It is not very consistent in its behavior. I suppose you don't pay these, no? No. You don't pay what? You don't pay your subsidies. Please, only stand up and take notes. We take your notes. They will always go up higher than you. Thank you. Thank you. Should we have 4K on the download? Or should it not be a 4K on WC?"
Walking,1683,2215, Okay.
Sitting,2215,3600," Nice milk was yesterday. Yeah. Today or sometimes. I had a note to take yesterday morning. You didn't hear about this? I was supposed to hear about this. I was supposed to hear about this. I had to use the time to go. I mean we could use the time to go. I mean we could use the time to go. I mean we could use the time to go. Ah, it on the ground. Ah, there's more of those down there. Ah, right. Has anybody been buying this? I think this is almost up to soup. I don't know. I don't know. I don't know. It's just going to be a bit It might come out. It might. We will see what will be. It's not. It's not. Good morning, you seem in a good mood. Oh, yeah, except it's outside. It's outside. Oh, it's not looking for you. Thank you. Can you see where you are? Well, she has your address. Thank you. Thank you. right here it's not too far alright there is a church there just across the street now it's across the the bar apparently for sitting and catching I don't know yes I've been across the road. Yeah, exactly. Yeah. This is a fun area. Yes. There's also TV. All right. Yeah. All right. One minute. How many goes? Two. Two. Yeah. Yeah. Yeah, yeah, yeah. Thank you so much."
Leisure Activities,0,91," Það er það sem við erum að hljóða. Það er það sem við erum að hljóða. Það er það sem við erum að hljóða. Það er það sem við erum að hljóða. Það er það sem við erum að hljóða. Það er það sem við erum að hljóða. Það er það sem við erum að hljóða. Það er það sem við erum að hljóða. Það er það sem við erum að hljóða. Það er það sem við erum að hljóða. Það er það sem við erum að hljóða. Það er það sem við erum að hljóða. Það er það sem við erum að hljóða. Það er það sem við erum að hl. There is mushrooms. So basically you put mushrooms in. Don't worry about it. I have my sauce. No, no. Anything you add is benefit. So we used to make in the farm. You do pasta, you do pasta. I do the pots of some kind of tomato based sauce. I do the. What are we actually doing here? And then freeze them in small 400 gram things,"
Meeting,91,1120," Yes. like yes yes yes yes yes uh aubergine for example and then you have mushrooms you have bacon that's it right right okay we're here we're good let's go let's go let's go let's go where is that oh my god you spend more time preparing the presentation than i spent can you take my ears off I do. It should be alright. No, it's off. No, hang on, wait, wait, wait. Castle. It's off. Castle. That's what you make for. It has people wearing cameras, look! That's also nice. So now you have to decide, right? Is this on? That's fine. I think this is generated by AI. Oh yeah, well some variation. Okay! Let's wait a second. My camera is in the way. Your time and date is also completely messed up. Oh, my time and date is messed up anyway. Oh, we were supposed to fix that. It didn't give me an option. Yeah, well, this is why we have the other dock. And also, now it's locked. Yeah, it didn't offer me the option to check it."
Using Laptop,1120,903," V3C2 data set. Plus we had the Marina video kit. I'm not sure if somebody of you knows how much hours are there, but I think tens or I think it was 1450 slide and again as much in the second slice. Is it 40? 14. 14. We're up to about 30ish with the addition that comes in this one. So this is the next, the final one here in 2025. We will have the MVK2 with this amount and then we have the full V3C collection with overall 3,801 hours. And we also have the medical data set, the laparoscopic hysterectomy with 100 hours. And yeah, think would be a great challenge in one month roughly so we may have in 2026 a lifestyle challenge as part of this right right right exactly so that could be another part for the vps where we look into these videos 400 hours 500 600 hours of content Right? That was. That? Hi, over the last four. 400 hours, right? Not quite as much. Fixed cameras as well, right? Yeah, sure, but it's only about, well, we'll go into the numbers in a bit. So that would be very nice challenges as well. And yeah, I think finally to conclude my part of the presentation, I think what we saw at the VPS is that currently all systems use state-of-the-art technologies like Clip and Blip and so on. But also there is some consistency within teams that the same team with different users performs similarly, which is good, I think. And the user interface interface is very important I think this is also a very unique aspect of the VPS it's not only let's say that the system behind but a lot is by the user interface and how you provide interaction possibilities. I feel nice to have kept the video browser. Yes, exactly. I think it's quite important. Exactly. Right, so that's it. So thank you very much. May I just short advertisement break in this point? If you think VBS is a cool thing to do and you haven't volunteered any judges from your team for E25, please let me know. Lin's going. Volunteer! Yeah, we'll be the ones here. You don't need to be there actually, judges can be remote as well. But if you're there, I'm going to let you in. You're going too? We can do it remotely, but what time? It's actually quite convenient for European time, because it's afternoon, so it gets into the morning in the morning. We can do it remotely. Andy, I will talk to Andy. He could be a good judge. Check with him and let me know. Okay, let's keep going. Remind me to remind Klaus to remind me to remind Klaus. I want to follow up with a short few slides about the LifeLock search challenge motivated by Gordon Bell's work on MyLifeBits. So Gordon Bell built a lifetime store and was built inside of a database. You could query through a nice interface. We want to take this into the community as well so over the past decade or so we've run a number of different challenges at NTCAR in Japan and Image Clay in Europe and one we're going to talk about today is the LSE Lifeblood Search Challenge kind of well really motivated by the video browser showdown challenge which was so successful and we're going to talk about that terms of growth, we started off with six teams in Yokohama in 2018, and most recently we had 21 participants in the most recent LifeLog Search Challenge, which took place just a couple of months ago in Phuket in Thailand. They're anchoring everything. So, LifeLog Day... A couple months ago is stretching into French territory, where you have the husband and the wife and the husband's mistress. It's a happy family. Yeah, exactly. Five months ago now. The dataset we have is not quite as large as the 3800 and one hour BBS dataset. It is an 18-month dataset from one person, an anonymous person. It contains wearable camera data from fixed image sequence wearable cameras, concept detectors, stuff like that. It contains some real camera phone photographs as well. Matched biometrics from monitors, heart rate sensors, et cetera, and watches. We did a bit of information access, but that's really problematic for privacy concerns and then activity detection annotations as well. So those datasets become reasonably large I think we ran to around about a million images give or take in these kind of datasets I really can't remember now 780,000 or something and we tend to look for images as answers, answers as answers to queries and they're the typical units of retrieval. So it's quite challenging, especially because you have to do anonymization. And with video data that's openly available online, you download the videos. With LifeLog data, you have all kinds of challenges related to faces and content on screens and phone content as you're using your phone, because this inevitably gets captured. So you have to come up a process where the LifeLog reviews and cleans their data. They share it with our researchers in the university. The researcher then checks to make sure that things are okay. And we resize all content to make sure text isn't necessarily legible. We then anonymize anyway the screens and the faces, and then we review it again and release the datasets. It takes quite a long time to do that, but then we even with that have strict access controls. If you sign up to use a lifeline dataset, you sign up to rules that says we can ask you to delete any image and you must do it, or delete the whole dataset. We haven't had to do that, but that's in there. Okay, so to have queries just as VBS has spoken about, we have known item, ad hoc, and Q&A queries. Known item queries"
Leisure Activities,903,2561," That's something like the sound of Hallelujah. So, see? That's G, that's C. Let me see this side. This one, this one, and this one. Yeah, this side. This is all I'm talking about. Okay, can I put it on? Do we have it in the garage a reaction? Oh, yeah. We can. We can. We can. We can. We can. We can. We can. We can. We can. We can. We can. We can. We can. We can. We can. We can. We can. We can. We can. We can. We can. We can. We can. We can. We can. We can. We can. We can. We can. We can. We can. We can. We can. We can. We can. We can. We can. We can. We can. We can. We can. We can. We can. We can. We can. We can. We can. We can. We can. We can. We can. We can. We can. We can. We can. We can. We can. We can. We can. We can. We can. We can. We can. We can. We can. We can. We can. We can. We can. We can. We can. We can. We can. We can. We can. We can. We can. We can. We can. very much. I don't know why. Ah, they were... I think they called it a bit of a... They might. They were here. I think they were not meeting also. I think they were in the back. Well, only coming up if you found the things that should be there. Yeah. But... E. Is that good? Yeah. E. E. E. E. E. E. E. E. E. E. E. E. E. E. E. E. E. E. E. E. E. E. E. E. E. E. E. E. E. E. E. E. E. E. E. E. E. E. drum. Yeah. Before it sounded like a chainsaw. How do you do, uh, F as well? Yeah, but is it easy at once? Oh, yes, I'll do a little happy. What do you do? Do a sweet dance around the house. Yeah, exactly. Yeah, I'll do it. I, I, I am afraid that there's going to be a lot of that when I'm done with this. I'm afraid that there's going to be a lot of that when I'm done with this. I'm afraid that there's going to be a lot of that when I'm done with this. I'm afraid that there's going to be a lot of that when I'm done with this. I'm afraid that there's going to be a lot of that when I'm done with this. I'm afraid that there's going to be a lot of that when I'm done with this. I'm afraid that there's going to be a lot of that when I'm done with this. I'm afraid that there's going to be a lot of that when I'm done with this. I'm afraid that there's going to be a lot of that when I'm done with this. I'm afraid that there's going to be a lot of that when I'm done with this. I'm afraid that there's going to be a lot of that when I'm done with this. I'm afraid that there's going to be a lot of that when I'm done with this. I'm afraid that there's going to be a lot of that when I'm done with this. I'm afraid that there's going to be a lot of that when I'm done with this. I'm afraid that there's going to be a lot of that when I'm done with this. Thank you.. But then you have things like Luca places here at one corner and it stays there for about a day. So that's a change you might want to... if you think of it as an industrial setting, that's a change. If someone puts a pile of stuff there, that's what you want. So I'll do a Christmas tree. Ooh! Christmas tree? Where are we taking the Christmas tree? Yeah, right. Rappelgabri. Nice! Let's go! Rappelgab cooking. I'll do all the cooking. Yes. Yes. Yes. Yes. Yes. Yes. Yes. Yes. Yes. Yes. Yes. Yes. Yes. Yes. Yes. Yes. Yes. Yes. Yes. Yes. Yes new piece of furniture, you want to learn, okay, this is now there, and this is done, and you can do this every day. I'm really sorry. I'm sorry. I really thought it was still not good enough. That sounds nice. Look, she can play guitar. No, I can't. You're playing? Yes. There's only two people who can play guitar. She's playing the piano. Oh, she can play the piano really well. No, I can't. She's like, I don't know. I don't know. Really good. Really good. Really good. Really good. That's not the title. The river runs through it. The river runs through it. The river runs through it. That's a perfect title. Yeah. Yeah. Yeah. Yeah. I mean, there's a lot of people who are coding things like barter splats. So you basically have to have those as a... Because there's a problem with having that kind of data as well. You get the data, and you have to have it. That's the's great. Well, it's really interesting. I think it's a good approach to make a nurse. A nurse will learn through your network. You might have your own experience. You basically do a point job. So you can give a job to tell Andrew who will probably need to do the most of the work. I picked a portion around the point. And then you alert the barometers so that you can start the sources that you have. So you get a bigger card. And then you can put this card in the card for weeks. With another castle. I just need a for weeks. With the lovely castle? From the castle. Malaheis. Malaheis is a lot more expensive. It was like 8,000 euros for a castle. Malaheis, by the way. You have to ride the entire castle to go. You have to take over by this path. Here it's great. Nothing is visible. It's just a... Change it to cattle bridge. And then we go to the farmhouse. Cattle, 25. They can play some happy ballad. Okay, there it comes. Just check it out. We can have a roll around. I think you need a set for a human-cow interaction. This is where it's like... To be fair, it will probably be the only video they can set for a human-cow interaction. Oh, this is great. To be fair, it will probably be the only video they've set for a human-cow interaction. So that sounds like a good idea. Yeah, it does......... Take this flower. It's a little bit more"
Leisure Activities,2561,2565,
Leisure Activities,2565,2566,
Leisure Activities,2566,2567,
Leisure Activities,2567,2755," Looks horrible. I'll get bathroom. Here, try some of these. Come on, I got it. Very alcoholic. Act a lot. I'm taking my five minutes out. Check my mail. So what are you painting, Ali? What are you painting? Uh... Yes. The instructions for this. You can reverse the instructions by looking at what I'm doing. That has to be slow. Now, take that. And then we will check it later. So this is a very simple cookie dough recipe. It's essentially 500 grams of flour, 250 grams of water, 250 grams of sugar. There's lemon and vanilla. Where is the a red star? Oh, there's a red star. Okay. Okay. Um, then it's lemon zest. So, zest. Lemon and lime. Lemon and lime. Lemon. Lemon and lime. You don't have lime have lime? That's not a side. I don't think you don't do lime, Dave. Yeah, I probably do. Really? I mean... It's a bit... How many people? Actually, you're right I mean, is this..."
Walking,2755,2769," Super. Takk for ating med. Honestly, we... You join with us. We'll record it. It's cool. No worries."
"The most fitting category for this segment is **Leisure Activities**. 

While there's a glimpse of people gathered around a dining table in the background, the primary focus and action within the frame is a person wearing a headset and appearing to be engaged in some form of virtual reality or gaming experience, which falls under leisure activities.",2769,2810," Super. Takk for ating med. Honestly, we... You join with us. We'll record it. It's cool. No worries."
Leisure Activities,2810,451, Not practice.
The image shows a person vacuuming a living room. This activity falls under the category of **Cleaning**.,451,453," It's from the Al I don't know. Tämä on takaisinvastainen. Tämä on takaisinvastainen. Tämä on takaisinvastainen. Tämä on takaisinvastainen. Tämä on takaisinvastainen. Tämä on takaisinvastainen. Tämä on takaisinvastainen. Tämä on takaisinvastainen. Tämä on takaisinvastainen. T Det er en kvarter som er på stedet for å stå på stedet. Det er en kvarter som er på stedet for å stå på stedet. Det er en kvarter som er på st careful. Be careful. Be careful. Be careful. Be careful. Be careful. Be careful. Be careful. Be careful. Be careful. Be careful. Be careful. Be careful. Be careful. Be careful. Be careful. Be careful. Be careful. Be careful. Be careful. Be careful. Be careful. Be careful. Be careful. Be careful. Thank you. Wow. Okay. I think we should throw everything away. I think we should throw everything away. We have so much food. should be okay, but otherwise it was contaminated. That is not the answer."
Cleaning,453,454," It's from the Al I don't know. Tämä on takaisinvastainen. Tämä on takaisinvastainen. Tämä on takaisinvastainen. Tämä on takaisinvastainen. Tämä on takaisinvastainen. Tämä on takaisinvastainen. Tämä on takaisinvastainen. Tämä on takaisinvastainen. Tämä on takaisinvastainen. T Det er en kvarter som er på stedet for å stå på stedet. Det er en kvarter som er på stedet for å stå på stedet. Det er en kvarter som er på st careful. Be careful. Be careful. Be careful. Be careful. Be careful. Be careful. Be careful. Be careful. Be careful. Be careful. Be careful. Be careful. Be careful. Be careful. Be careful. Be careful. Be careful. Be careful. Be careful. Be careful. Be careful. Be careful. Be careful. Be careful. Thank you. Wow. Okay. I think we should throw everything away. I think we should throw everything away. We have so much food. should be okay, but otherwise it was contaminated. That is not the answer."
