description,start_time,end_time,transcript
Leisure Activities,454,2258," It's from the Al I don't know. Tämä on takaisinvastainen. Tämä on takaisinvastainen. Tämä on takaisinvastainen. Tämä on takaisinvastainen. Tämä on takaisinvastainen. Tämä on takaisinvastainen. Tämä on takaisinvastainen. Tämä on takaisinvastainen. Tämä on takaisinvastainen. T Det er en kvarter som er på stedet for å stå på stedet. Det er en kvarter som er på stedet for å stå på stedet. Det er en kvarter som er på st careful. Be careful. Be careful. Be careful. Be careful. Be careful. Be careful. Be careful. Be careful. Be careful. Be careful. Be careful. Be careful. Be careful. Be careful. Be careful. Be careful. Be careful. Be careful. Be careful. Be careful. Be careful. Be careful. Be careful. Be careful. Thank you. Wow. Okay. I think we should throw everything away. I think we should throw everything away. We have so much food. should be okay, but otherwise it was contaminated. That is not the answer."
Watching TV,2258,351," like some of these I don't know what people do there. I was looking through the window and I was looking. What are they doing? Some stocks go up and down, or they go up and down, or they go up and down. I'm on a date. I'm on a date. I'm on a date. I'm on a date. What's the difference between voice raised in Bitcoin? Yeah, that's right. Or, we mean stocks in here. We mean stocks in here. Yeah, and stocks still have some You see, as of you know, some companies that does something or does something else. Back in 2009, I was big company buddy. I don the movie. Yeah,? I watched the video."
Leisure Activities,351,356," This must be distinctly understood, or nothing wonderful can come out of this story."
Using Laptop,356,358, And the interaction.
Sitting,358,2617, I'm perfectly convinced that Hamlet's father died before the play began.
Leisure Activities,2617,3259," This person gave a name. Thank you. Because we take these beer glasses, we are going to grab water every two minutes. I thought this must be more. Hey. Oh, you have a great shot. Yeah. It's not a good light. Very well. Good thing I got not like we're working now. The weather here is nice."
Sitting,3259,549," And also same on this side. Yeah. I just came here, but in theory, we don't always come to a discussion. Yes."
Leisure Activities,549,692," Session oh you Just sit wherever you want. OK. OK. So I'm going to sit behind you. OK, Jake, sit. Sit, sit. Do you like that seat? Did you put all of us naked? I don't like this chair. Where is this chair? Not a chair. Simon? It's done up here. I'm going to sit somewhere else. Yes. And it should be somewhere else as well. I have no choice. He sat on my old spot. There you go. There you go. I'm going to you go. Would you like some water? I can't. You can just give me the And you can just put this next to you. Then we have a different view and something interesting in the camera cheers"
Eating,692,2606," so we're randomizing seating assignments. I noticed. Wow, that looks nice. But you are okay to sit in the same place that you always have to. We will need something to distribute the results. We can either fight Ali or... Fair enough. I also decided that I probably had no chance against Young. You're a tall guy. You're young. I'm not choosing violence. So... You can decide, guys. Poker. Are there any ladles? You have to figure out what's the best seed. Ah, there's one ladle. Or the other one. Last one. like you can put it just straight on there Take this below. Thank you. Everyone has to choose. I have to wear this to 10. Perfect. Yeah. Oh my god. That's the next best thing in terms of life. Is that the one we brought in? Yeah. Well, that's fine. I have no idea. I mean, we can... This,... I was afraid 15 minutes in my room. You are not blinking by the way. You're not recording. Is that on purpose? No, I don't know. I actually wanted to record. Alright. You may be accidentally swipingiping, you should photo-move, because now it's still Milan, so I think you're taking pictures. Can I start there? Yes, you're in photo-move. Aha. Are we not distributing? I mean, until people come. Werner has given us permission. Everybody except for Kachel. I know there's somebody else missing. I'm in. Kachel is missing. Did I miscount them? Kachel is missing. I called called the chef. Sorry, I missed the camera. He's helping. Can we randomize the seats? Maybe it's the next day's for Florent. Not always the same. Not always the same. Different angles. Lucy, help yourselves. And this is for salad on top? You can ask the chef. Werner, the salad is garnished? Yeah, it's garnished. I mean it's supposed to be rocket only, but it's rocket mixed with spinach and some stuff. There was no pure rocket at the start. Yeah, exactly. And there is from a channeliano on top of it as well. Because we could get just rocket salad. That's a lot of cheese. Yeah, you get cheese. It's a lot of pasta cheese. I like parmigiano, so I wonder who would get, you know. Pasta cheese. Yeah, yeah, yeah. This is for me. Actually, it's my fault. I kind of regretted it and put it in the fridge. We could have forgotten about it. But cooking took so long, so it's probably better to put it in the fridge. There's no cheese in... Yeah, put as much as you want. Oh, there's no cheese in the fridge. So it's not just garnish, it's actually an ingredient. That would be a great excuse to put extra cheese. It's not pure, maybe vegan. Why are you asking such stupid questions? It should be in the... in the... you know... Modular. Werner is thinking about everything. Are you sure the rest of the risotto is vegan? Is there no butter in there? Yeah, there is butter. It was a vegan cow. I know, I know. Nobody has any restrictions. It was a vegan cow. And to verify that that's the case, Klaus and John went to visit them. And talked to each one of them. Are you vegan? Cow was mmmm. And Ari he's also mmmm. Does he even have like a tiny allergy? No. Nothing? Such a healthy group. Okay. I guess Kalfa will join when he's done. Oh my god, let me close the can. Yeah let's go. I guess you see something or something. Oh, well, you haven't even taken anything yet. Yeah, no. I waited until people were in. Here, come eat. It's not that good. Let's see everybody else eat. I'm supposed to be here, in the back of my head. So that's's why I'm calling you knowing that you probably won't finish unless you're called three times."
Leisure Activities,2606,2754," Whoever needs me for some food cooking, let me know. What do we do? Das ist ein guter Kaffee. Do you want to go up there? What about here? Do you want to go up there? Yeah. Uh, Stefan? Mm-hmm? Before you were three, there was a very sensible, sensible, sensible hour that"
Talking,2754,3009," I don't know. Now I'm doing this box, box. This is also a... Yeah, yeah, it's a box, a paper box. Can we do a... Okay. Yeah, come in, just come in. You can go in first. Let me wash my hands. You can wash my hands. You can wash my hands. Yeah, okay, come on, ready? Yeah. Yeah. Come on, yeah. Now I'm going to go straight in there. I'm going to happy quiz ready. I quiz. I need somebody to help me. Happy quiz. We should probably sit and do the Happy Fizz over here. Do you have a choice? Okay, ah, does it work? Okay. Okay. Okay. Okay. Okay. Okay. Okay. Okay. Okay have help? I brought it in. I brought it in. But I don't remember where. Anything that had been brought in? The camera? We might be okay. That's fine. We can get out of it. Yeah. Yeah. Yeah. Yeah. All right. I think I got this. I'm not doing it. I'm just talking to everybody. I'm making a call. I'm not talking to you. Yes. I'm just asking maybe you need a kiss. Yes. I like the coffee. I like the coffee. I like the coffee. I like the coffee. I like the coffee. I like the coffee. I like the coffee. I like the coffee. I like the coffee. I like the coffee. I like the coffee. I like cooking man. I like kitchen. That was a lot of cooking. I agree. There was some other things. I think we need a big cover. I want to do this one. I want to is your fault. That's right."
Leisure Activities,3009,3074," I'm sorry. The SD card has an X, an actual X on it. An X? It's the other way around. Actually no battery? No, the battery's OK. No, no, no, no, no, no, no. There's no battery in there. And your SD card is still green, which means you've been taking too many business calls. So my battery's fine then? OK. No, it's just not showing anything on the battery. It has no battery in it. But it has an X on what looks like an SD card. No, it has the X over the battery because it has no battery. Ah, okay, fine, okay. Fantastic. Okay, who's up? Happy Chris. Happy Chris. Happy Chris. Happy Chris. Happy Chris. Let's go. Yes. Four people. Yay! I'll sit right here in front of everybody. And I assume somebody's's gonna bring coffee. Oh no, this is the quiz with the couple from every category. Yes, couple made the quiz with GPT stuff. So who are the people who take part in the happy quiz? 50 questions. Okay, so we have Anan, Florian, Floor, Flo, Tien."
Playing Games,3074,147," No, we need somebody to help me be the judge. If you judge. Everybody press the button. What's the capital of Ireland? Dublin. No you have to press the button before you answer. We're not playing team games. Playing team games is better. Team is better. Ok then, organise yourselves into teams. How's that noise? Team 1. What's the noise? I will join this team. I don't think so. I think we're guessing you're lying. I know all the answers. I know you know them all because I know he has knowledge about, I think pop-pop is a category, right? I was wondering if you could be on for all the time. Today? It's only two hours left. Okay, fine. Take a break. I think that's probably the case for the others as well. Yeah, yeah, fine. It's okay. We have only two hours left. Yeah, we take it. Or maybe you two, some of you were very thoughtful. We have to do the happy quiz, though. After this, we'll get the race and then... Okay. Just to tell you that... We need eight people. Oh, that's a good point. We need eight people. Happy quiz. Happy quiz one by one. We can't 8 people Ok focus focus focus Happy Quiz one person per team Yeah one person per team Alright alright No that's Ali Ali Get here Now let's go for the first round How How about them? No, maybe the second round. No, where are you going? You're here, take your questions and sit down. But you're asking questions already. Wait, so she knows the answer? Okay, Ali, house. Step on. Step on. Happy quiz. I have to finish something. Luca? Bow. Yeah, sure. Luca, okay. Sure, yeah. Then you can be a helper. Yeah, sure. You can be a helper then. How about you? Okay. What do you have to do? Sit there and grab the box. Let's get a practice round in. You practice round. Okay. I don't know things about things. Is he here? Yeah, he is. Okay, hang on. Luca has to be yellow. Ollong has to be red. Yeah. Florian has to be blue. Yes, sir. And Tien has to be green. We're going to have a practice to make sure we understand how this works. What's the name of the bar? Kios. Kios, not Kios. Kios. Kios. Kios. Let's try again. What color is the house? Yellow."
Leisure Activities,147,3057," I'm wrong, uno. I don't have anything. What is this? I'll get it, I'll get it, okay. Okay, let's start with Bjorn. I would say... It's your mission. It's your mission to stop them. Yeah. Uno. Good job. But he's Uno, you know. Uno. Good job! Uno. You blocked? Somebody have a reshuffle card? Block two. Okay. Yeah. Unfortunately, I have this one too. Wait, is that a good thing? I don't know. You can move over there. Uno. Okay. Thank you. I'm probably better off with you. Okay. I get it. I don't know. I don't know if that was the idea. Yeah. Much nicer color. Um, UNO. UNO. What is... UNO. Well, I wish I I could say uno, but instead I will say... A one? Uno? A one. Does he have a green card or a one? Nooooo! Oh, he has a green card! Yay! I have 40-something, so I'm not bad. Yeah. How did you get... I'm an 11. 21. No, that's a lose. How'd you count? I think for 3000. Yeah. But only like 8 though. If you don't skip me then I have nothing more to say. Have you counted them? Add the numbers. Add the numbers. This one and those two are 20. And these are... no, no, no. Sorry, 10, 20, 20. So I know where I'm going with this."
Playing Games,3057,2413," Okay, let's go again. Pretty good at darts. This is better. Hardly work, yeah. Yeah, we'll do this after darts. Timo will get darts. Yeah, he did. I have tried darts, though, and yeah. Easy. Hard, true, easy. You don't have a very good base. I'm just trying to get it. I'm sorry. It's a suit. Yeah, I know. It's fine. Yeah, you can say it like, look. Yeah, look. Move. Move, move, move, move. Move, move, move, move. Yeah, yeah, yeah. Move, move, move, move, move. Move, move, move, move, move. Yeah, yeah, yeah. Move, move, move, move, move. Move, move, move, move, move. Move, move, move, move, move. Good evening. Let's go again.., not the turn. Sorry. Oh, I still have to do it? Yeah, because you missed the card. Yeah, maybe. Yeah, maybe. Blue button, three? Three. Oh, wait, wait, it's ready. Yeah, you can. Oh! Oh! Oh! I'm knowing as well. You're uno, yeah. What's the color? What color? Ah, well, this is very much about the color. It's a little blue. It is. It is? Yeah. Yeah. I'll pick up. Two more. Two more? Two more? No, no, no. Oh, very. Do you like a hot dog on the table? Okay, nothing. Hey, it's snowing. Check your cost. No! You can get it done. I'm gonna do it over. Noooooooooooooooooooooooooooooooooooooooooooooooooooooooooooooooooooooooooooooooooooooooooooooooooooooooooooooooooooooooooooooooooooooooooooooooooooooooooooooooooooooooooooooooooooooooooooooooooooooooooooooooooooooooooooooooooooooooooooooooooooooooooooooooooooooooooooooooooooooooooooooooooooooooooooooooooooooooooooooooooooooooooooooooooooooooooooooooooooooooooooooooooooooooooooooooooooooooooooooooooooooooooooooooooooooooooooooooooooooooooooooooooooooooooooooooooooooooooooooooooooooooooooooooooooooooooooooooooooooooooooooooooooooooooooooooooooooooooooooooooooooooooooooooooooooooooooooooooooooooooooooooooooooooooooooooooooooooooooooooooooooooooooooooooooooooooooooooooooooooooooooooooooooooooooooooooooooooooooooooooooooooooooooooooooooooooooooooooooooooooooooooooooooooooooooooooooooooooooooooooooooooooooooooooooooooooooooooooooooooooooooooooooooooooooooooooooooooooooooooooooooooooooooooooooooooooooooooooooooooooooooooooooooooooooooooooooooooooooooooooooooooooooooooooooooooooooooooooooooooooooooooooooooooooooooooooooooooooooooooooooooooooooooooooooooooooooooooooooooooooooooooooooooooooooooooooooooooooooooooooooooooooooooooooooooooooooooooooooooooooooooooooooooooooooooooooooooooooooooooooooooooooooooooooooooooooooooooooooooooooooooooooooooooooooooooooooooooooooooooooooooooooooooooooooooooooooooooooooooooooooooooooooooooooooooooooooooooooooooooooooooooooooooooooooooooooooooooooooooooooooooooooooooooooooooooooooooooooooooooooooooooooooooooooooooooooooooooooooooooooooooooooooooooooooooooooooooooooooooooooooooooooooooooooooooooooooooooooooooooooooooooooooooooooooooooooooooooooooooooooooooooooooooooooooooooooooooooooooooooooooooooooooooooooooooooooooooooooooooioioioioioioioioioioioioioioioioioioioioioioioio Sorry about that. I have no option. Sorry. Sorry. Sorry. I don't understand what your question was. I'm very interested in that point. How? I'm not sure. It depends on how we use the phone. It depends on how we use the phone. Does anyone need to change? Does anyone need to change? I'm sorry. Sure."
Leisure Activities,2413,2426," So here, I think we're running out of streams, so add one. Yes, add a stream. A power pack and a curtain. Power packs are actually much more difficult to get, because they take much longer to... I've got one in my bedroom. Your power pack is also upstairs. Upstairs, I've got a five... Yeah, but I gave it back to... In my bedroom you get one. I get one. And the athletic card... That's more difficult. Look at... The problem is... I mean, there's only a limited number. So if we... We'll have to see gonna be others that are running out too. Just the one who wears it? No, I'm saying if we're running out of screens and we are... People might be following that. There's two cards out here. You know what I mean? Are you guys on that side of the table? Somehow you're a really good pack today. We third order of operation is turning off unplugging and then removing the speaker."
The segment is classified as **Leisure Activities**.,2426,2431," So here, I think we're running out of streams, so add one. Yes, add a stream. A power pack and a curtain. Power packs are actually much more difficult to get, because they take much longer to... I've got one in my bedroom. Your power pack is also upstairs. Upstairs, I've got a five... Yeah, but I gave it back to... In my bedroom you get one. I get one. And the athletic card... That's more difficult. Look at... The problem is... I mean, there's only a limited number. So if we... We'll have to see gonna be others that are running out too. Just the one who wears it? No, I'm saying if we're running out of screens and we are... People might be following that. There's two cards out here. You know what I mean? Are you guys on that side of the table? Somehow you're a really good pack today. We third order of operation is turning off unplugging and then removing the speaker."
Leisure Activities,2431,2449," So here, I think we're running out of streams, so add one. Yes, add a stream. A power pack and a curtain. Power packs are actually much more difficult to get, because they take much longer to... I've got one in my bedroom. Your power pack is also upstairs. Upstairs, I've got a five... Yeah, but I gave it back to... In my bedroom you get one. I get one. And the athletic card... That's more difficult. Look at... The problem is... I mean, there's only a limited number. So if we... We'll have to see gonna be others that are running out too. Just the one who wears it? No, I'm saying if we're running out of screens and we are... People might be following that. There's two cards out here. You know what I mean? Are you guys on that side of the table? Somehow you're a really good pack today. We third order of operation is turning off unplugging and then removing the speaker."
Unclear,2449,2452, You can unplug the power bank from the camera.
"The image shows a person walking. Therefore, the category is **Walking**.",2452,2529, I was going to put this in and cut an hour and a half.
"The image shows a person sitting on a sofa in a living room. The person is not engaged in any particular activity that falls into the provided categories. Therefore, the most appropriate classification would be **Sitting**.",2529,2590," For me it should be like, basically... If I really kind of just kept on... I think it would stop at... Probably... 6 o'clock. 5? Yeah. 10 hours. From 8 am. Yeah. Well, you're not getting that. Hi. Can you take my card? Maybe I wrote to the room? I don't believe it. I wonder... So you're on your card already? No, I'm about to run out. Keep it. It's interesting how I had Pad Thai already in Europe and it was very different."
"This segment should be classified as **Leisure Activities**. 

The image depicts a group of people gathered around a dining table, suggesting a social occasion or a meal. The overall atmosphere appears relaxed and convivial, consistent with leisure activities.",2590,1756," Way back, you remember with the tatsim maybe? They switched to these small square chips. It's probably meat, but kind of... It's like crickets of chicken. Didn't taste like... You don't know them? Yeah, I think it's pretty good. 20 minutes. Yeah. 15 minutes. So it's gonna be dessert or something? I don't know. I have no idea. You were talking about some rice. Yeah. I'm sure they're going to do it. I think it's done. I think we should go to the pub. They've already gotten out the rice and put it in the pub. It's actually cheap, right? What was it? I think it's 50 Euros or something. Seriously? For a pint? I think for 6 maybe. That's cheap. I wouldn't think. No, I think that was for the ride from, I think, wherever else we went lately, from Anapol. Oké. Ja, dat is de pannekoos. En dat is de pannekoos. En dat is de pannekoos. Dit is de patate. Dit is de patate. Dit is de patate. Dit is de patate. Dit is de patate. Dit is de patate. Dit is de patate. Dit is de patate. *** Okay. Субтитры сделал DimaTorzok You can keep the glasses because people will use them for the milk prices. For what?"
Talking,1756,2887, On the ocean. And ladders. They found pineapple in the mountains. I will hold this. I will remember for you. Maybe. Or maybe. Or ready? Sorry.
Leisure Activities,2887,2899, What's wrong with you?
"The provided image shows a group of people gathered around a table, seemingly enjoying a meal. Some individuals are seated, while others are standing and interacting. The overall atmosphere suggests a social gathering focused on dining. Therefore, the most appropriate category is **Eating**.",2899,2901," No, no, no."
Playing Games,2901,3349, Half this open.
Leisure Activities,3349,3358,
"**Playing Games** 

The man in the foreground appears to be holding a video game controller or a similar device, suggesting he's engaged in a leisure activity like playing games. The presence of other people in the background and the relaxed setting also support this classification.",3358,3361,
"The video segment shows people gathered around a table with food, and one person is using a VR headset. This suggests a social gathering with an element of entertainment. Based on the options provided, the most fitting category is **Leisure Activities**.",3361,3362,
"The image depicts a group of people gathered around a table, likely engaged in a meal. The presence of food on the table and the seated arrangement of individuals strongly suggest the activity of **Eating**.",0,554, And I have to do better.
Playing Games,554,821," Somehow I think I'm doing this wrong. Oh, that's not good. It was through a paper from the Eiffel Tower. From the Eiffel Tower? Yes. It took a while to go down. Like that? I have to track it down. This one is not filled the way I used to build when I was younger, so there's something clearly wrong with this design. Oh, it has two overlapping wings? Yeah, that's why it's something wrong with it. That's not the way it used to be. It's very rude. I did something wrong apparently. Well it happens to the best of airplane engineers. I remember now. You follow this back up like this. And you get away from the close. Alright. So that's a Concorde right right? Yeah, almost. Yeah. Aye. This one doesn't seem like too much, right, anyway? This one looks a lot better. Ready? Why do you keep hitting the top? Now the nose is completely destroyed. Something is totally wrong with this. Anyone see Stefan? He is in his room. Which one is his room? I think it's the second on the right. The second on the right. Alright Klaus, ready? Good drift though. Oh nice. Wow, it flies very straight! Which is I think sometimes the most difficult part of a paper airplane. Very nice. Slighter. Oh this one is broken. It turns too much. It works very well. It just doesn't work. Very stable."
**Leisure Activities**,821,1117," No, there Thank you so much. I'll mention it. Oh, oh, oh."
Talking,1117,1135, Because then you can already give those to the helpers and they can start copying later on.
**Leisure Activities**,1135,1297," Somebody needs to do that. You need to. I can go. Two more SD cards. Actually we have one one spare SD card. Yours is your camera off... Oh, but your camera is not off. Okay, okay, okay, okay. Are we going to risk this? They are not hot swap capable. No, they are definitely not hot swap. So you need to turn them off, take out the... Take them off, and this is how it will... We try this. We try this. What could possibly go wrong? I think we have... We should have one more. Maybe we have 20 back. I think we have... We should have So in case this is an issue. Yes but it might, the camera might take, it's not enough. Well we will, we will see. Okay, so we're just going to"
Sitting,1297,3555," Thank you. You can give that to one of the helpers. Now we're going to crack a new one open. Thank you. Ninety-nine. Ninety-nine. Oh, that's it. Scissors. Where's ninety-nine? Okay. Where did everybody disappear to? So what? So, you were missing. Sorry. Uh... Everybody laughed."
Moving Furniture,3555,455," I don't give a fuck. Ja, ich glaube,. Okay, så. Du har en kamera på dig. Ja, jeg har en kamera. Ja, jeg har en kamera. Ja, det er det. Hvad er det You know Are we drinking on camera? Yes Okay Lue Schwein But Lue Schwein is also a thing but a very different thing Oh, it's so funny. I want some blue schwein."
Unclear,455,460,
