description,start_time,end_time,transcript
Talking,825,895, So I need to bring you more stuff from Switzerland to change your opinion. Okay. Kanskje vi kan ta en kvart? Kanskje vi kan ta en kvart? Kanskje vi kan ta en kvart?
"The video segment shows a person in a kitchen. They are walking around the kitchen, and picking up and putting down items. Based on these actions, the most fitting category is **Walking**.",895,940, It's your turn.
Playing Games,940,973," I need to go to the bathroom. John?. Ja, maar... Oh, ja, ja, ja, oké. Oké. Dus als je op de hoek bent, moet je eerst de lach op de lach doen, en dan kun je de lach op de lach doen. Dus als het jouw turn is, moet je de lach op de lach doen? Ja, je moet proberen de lach te laten lachen, zodat het mogelijk is. Oké. Wat kun je hier doen? Ik ben een origamiër. Ik ben een origami? I'm going to attempt to do everything. Are you playing also? Yeah. Do you want to be in the next place? Yes. And basically, we're going to play with the logic. Yeah, okay. So the idea... So the idea is to get a different card. And basically whoever's card is in the two can decide on the format of the card. You can put down one card, you can put down a suit. Three or four cards in different suits. You can put down pairs or triples or something like that. And then everybody else has to follow that pattern, but always put higher. But is this like by Jolly? Maybe, because I don't know the game. But always put higher. But the order of suits is a little bit different. So you have spade, to the north, flask, diamonds and cards so if somebody puts down three or four of spades then you could put down three of flask ok so you have to call that sequence, so you probably put three of the same color, but you have to... You have to raise. You have to raise. Ah, okay, so you can mix numbers. So if it's just one card, then you can basically put one card as long as it's higher. Okay, and it's higher... It may be a higher number or a suit"
Playing Games,973,1323," I need to go to the bathroom. John?. Ja, maar... Oh, ja, ja, ja, oké. Oké. Dus als je op de hoek bent, moet je eerst de lach op de lach doen, en dan kun je de lach op de lach doen. Dus als het jouw turn is, moet je de lach op de lach doen? Ja, je moet proberen de lach te laten lachen, zodat het mogelijk is. Oké. Wat kun je hier doen? Ik ben een origamiër. Ik ben een origami? I'm going to attempt to do everything. Are you playing also? Yeah. Do you want to be in the next place? Yes. And basically, we're going to play with the logic. Yeah, okay. So the idea... So the idea is to get a different card. And basically whoever's card is in the two can decide on the format of the card. You can put down one card, you can put down a suit. Three or four cards in different suits. You can put down pairs or triples or something like that. And then everybody else has to follow that pattern, but always put higher. But is this like by Jolly? Maybe, because I don't know the game. But always put higher. But the order of suits is a little bit different. So you have spade, to the north, flask, diamonds and cards so if somebody puts down three or four of spades then you could put down three of flask ok so you have to call that sequence, so you probably put three of the same color, but you have to... You have to raise. You have to raise. Ah, okay, so you can mix numbers. So if it's just one card, then you can basically put one card as long as it's higher. Okay, and it's higher... It may be a higher number or a suit"
Playing Games,1323,1364," Since we have all the time I guess it's probably not too... Well, not too... Oh my god. That's good. That's an option. So what I mean... We just have a... We're going to have all three aces but basically any, any like, could he keep ace with, with one of these two aces? yeah, exactly oh, I can't have them right but could it do any, any, any higher color? no no, because you need, you need to add in an ace that's higher than what you said. Ah, okay. No, no, because you're basically... The definition of higher here is that the top card is the highest. The top card is the highest. Yes, but I used to call it... Even the number or the color that is higher."
"The video segment shows a group of people in a kitchen environment. They are interacting with food on the counter and around the island, and some are preparing or handling food items. This strongly suggests activities related to **Cooking**.",1364,1729," Cảm ơn các bạn đã theo dõi và hẹn gặp lại. The top part of the drink needs to be higher than the top part of this drink. So it could only be a nice addition. So it means if I don't have a good result, because you have all of the... Yes, yes, yes. So you have to do this. Okay, are you the chefs for this afternoon's lunch? We have a problem. What? Some of the chicken is not okay anymore. What? It's out of date today. Yes, they kissed. No, we have to be very careful. We have to make sure everything is right before we lose it. Otherwise everybody can get sick. And then we're all stuck. Happy is extremely careful. Look, I'll show you. OK. And then it's your turn to dictate the play. Yes. All right. Are you all screwed? Yes. Yes. Good. Yes. Yes. OK. OK. OK. These are good. So now we'll basically do it with the. These are. OK. I'll cheat it. Because don't know. I see, yeah. Sorry. No, because she was the... Yeah, yeah, yeah. Everybody's game is very... Tomorrow's chicken. She picks the package. So we're going to have to pick the package. This isn't for everyone. And I can pick more, right? You're afraid to eat those drinks. Oh, you want some more? Yeah. There's other things, like... You mean that one? Yeah. I have it. Okay. I'll take another one. You don't need it. Okay. But here, I think... I have a... We have a salad next week. We have to get... We have to follow the pattern. And I think we need four here. Four B. Continuously. Continuously? Oh, okay. That's a very good constraint. Yeah. So these are... These make sure that they're not... Multiple last tests. 8 December. 8 December. 2 for 5 is... It's cheaper in... No, no. It's because with the skin. You have enough chicken, right? Skin and bones. But then look, tomorrow you're doing two chickens. Remember the plan was that we're doing three different chickens. Chicken curry. Chicken curry and chicken hot pot. What if the chicken is going out tomorrow? That's what I'm saying. The chicken is going out today. I won't have chicken curry. Could you do lamb curry? I can't eat lamb. I can't cook something that I don't even eat. So we can keep that. It's a lot, just keep it for tomorrow. Keep some for tomorrow, some for today. Tomorrow my chicken curry is Thursday. So you can use the chicken breast for the day. Thursday, just the 7th, 6th of December. So you can of December yeah it's freezing you're gonna use them tomorrow? yeah tomorrow, Thursday Thursday, it is tomorrow Thursday is tomorrow Thursday just 3, 4 of December right? 5, 7? yeah yeah, yeah, freezing still 3 more so you don't have to freeze them, we're just gonna use them tomorrow they're gonna be fine okay, okay, that's fine is it enough for today? it's just the ones that we don't I'm very scared of this this chicken It says it's today exactly and it's been open since yesterday Oh you buy six today four Okay smell it somebody who has a good nose tell me that chicken is ok So this one is fine?? Oh exactly. That's what I said. Is it all? Yeah, is it enough? I think so. Then get rid of these. Or check these to make sure they're all... No, this one's okay. The fifth and seventh, right? No, fourth. So just get rid of them and use this. Is that enough for you? I think it's enough. It's open already. It's best before, it doesn't make it worse after. It does. It's still good. It's still good, yeah. Make your decision. We trust you. Maybe do this one, but not the open one. That one should be okay. It's the same. No, the other one is open. It's just over. No, it's since yesterday. No, it's over yesterday. Oh, but tie it. So this one is okay. Yeah. It doesn't hurt. It doesn't hurt. This one is just fine. Smell the bottle. It's fine. Yeah. It's fine. Continue your work. Here. Here. Here. Here. Here. Here. Các bạn hãy đăng kí cho kênh lalaschool Để không bỏ lỡ những video hấp dẫn Lấy xuống, lấy xuống, rồi... Ok, một cái này."
Cooking,1729,3342," Không, không có. à à à à à à à à à à à à à à à à à à à à à à à à à à à à à à à à à à à à à à à à à à à à à à à à à à à à à Cảm ơn các bạn đã theo dõi và hẹn gặp lại. I don't know. I don't know. I don't know. I don't know. I don't know. I don't know. I don't know. I don't know. I don't know. I don't know. I don't know. I don't know. I don't know. I don't know. Onions! Not napkins! nha nhìn nó nhạc nhạc nhạc nhạc nhạc nhạc nhạc nhạc nhạc nhạc nhạc nhạc nhạc nhạc nhạc nhạc nhạc nhạc Các bạn có thể nhìn thấy những đồ ăn của mình ở đây. ừ ừ"
Cooking,3342,179," Các bạn hãy đăng kí cho kênh lalaschool Để không bỏ lỡ những video hấp dẫn I don't know. Well, don't count on it too much because the reaction is more. We don't. We don't have recipe. And I don't want to go over that. I don't want to go over that. I don't want to go over that. Oops, one on there. Okay, I'll take that. Then you go. There you go. Perfect. ừ ừ anh có nhiều đâu có nhiều này đúng không Nhưng mà chưa anh mình phải đổ nước ra được ok Các bạn có thể nhìn thấy những bây giờ mình sẽ xài, chưa xài mà bây giờ em nấu nước em á bây giờ em nấu nước em á nghĩa là tắt cái bếp em mới mở nghĩa là tắt cái bếp em mới mở cái bếp em mới lấy mùi ra thế bây giờ em nấu bỏ bếp đó ra đi thế bây giờ em nấu bỏ bếp đó ra đi thế bây giờ em nấu bỏ bếp đó ra đi nghĩa là tắt cái bếp em nghĩa là tắt cái bếp em nghĩa là tắt cái bếp em bây giờ em nấu nước lại cho ông chị bây giờ em nấu cho nóng rồi"
"The video segment shows people in a kitchen actively preparing food. They are chopping vegetables, using the stove, and handling ingredients. Therefore, the most appropriate classification is **Cooking**.",179,1562," ừ ừ Các bạn nhìn thấy không? Cắt thêm bánh mì Các bạn nhớ đăng ký kênh để ủng hộ kênh của mình nhé. ừ ừ ừ ừ ừ ừ ừ ừ ừ ừ ừ ừ ừ ừ ừ ừ ừ ừ ừ cái bánh mì của mình nhé. Cái này lấy được lên bàn để đưa ra Nó không sống được Bỏ ra, bỏ ra Được bỏ ra cho trời, múc đi Đang quay lên, đang quay công thức này rồi Giờ tới hết sống rồi, có gì nữa Chỉ cần ném lại thôi Bỏ mấy cái gia vị, bỏ mấy cái củ"
Cooking,1562,1782," So, maybe. The The The Kampung Kampung Ngon quá! The The để em chắc chắn cho kia chắc chắn cho ừ ừ"
Cooking,1782,2076, ừ ừ Các bạn nhớ đăng ký kênh để ủng hộ kênh của mình nhé.チョコレートんん The Sautéed pork belly Svartålskapet Các bạn nhớ đăng ký kênh để ủng hộ cho kênh lalaschool Để không bỏ lỡ những video hấp dẫn số 6 Cảm ơn các bạn đã theo d tay của mình đang bị đổ ra rất nhiều. ừ ừ
Cooking,2076,2081,
Cooking,2081,2267, I think a lot. rất là nhiềuon Nấm gà Gà ăn xong Gà sôi
"**Cooking** 

The segment shows two individuals in a kitchen environment, actively engaged in food preparation. One person is seen handling ingredients on a countertop, while the other is near a stove, suggesting the process of cooking. This aligns with the ""Cooking"" category.",2267,2456," Các bạn hãy đăng kí cho kênh lalaschool Để không bỏ lỡ những video hấp dẫn Ngon quá! Các bạn nhớ đăng ký kênh để ủng hộ kênh của mình nhé. bà mẹ ăn bánh mì, bà mẹ ăn bánh mì Các bạn nhớ đăng ký kênh để ủng hộ kênh của mình nhé. ừ ừ à à à à à à à à à à Cảm ơn các bạn đã theo dõi và hẹn gặp lại. The The The The The The The Norske Norske Các bạn có thể nhìn thấy những cái bánh mì này ở đây. Các bạn có thể nhìn thấy những cái bánh mì này ở đây."
"The provided segment appears to depict **Cooking**. 

Here's why:

*   **Kitchen Setting:** The scene is clearly a kitchen, with a stove, countertops, and various food items.
*   **Actions of Individuals:** One person is actively working at the counter, seemingly preparing food. Another person is near the stove, also engaged in what looks like food preparation.
*   **Presence of Food:** There are many food items and ingredients visible on the kitchen island and countertops.

While other activities might occur in a kitchen, the visual cues strongly point towards food preparation and cooking as the primary activity in this segment.",2456,2480, Rửa cái đó đi Các bạn có thể nhìn thấy các loại bánh mì của mình ở đây. Các bạn có thể nhìn thấy các loại bánh mì của mình ở đây. nhà của chị Hưng hả?
Cooking,2480,2540," dạ, cái đó là quán này nhà bị hư hả?"
Cooking,2540,2541," Các bạn nhớ đăng ký kênh để ủng hộ kênh của mình nhé. anh đi hỏi gì? gà bị hư rồi à nghe hình gà bữa bị hư hả bữa bị hư không có gà tạo lao, không có gà mì mì xúc gà chị xúc gà ngày kia rồi bỏ ra đi 24 phút rồi xong rồi tìm kiếm cái gì để hồi Đảo nào Các bạn có thể nhìn thấy những đồ chơi của nhà hàng ở đây. Các bạn có thể nhìn thấy những đồ chơi của nhà hàng ở đây."
"The segment shows two people in a kitchen, with one person actively engaged in preparing food at a counter with a sink and groceries. This activity falls under the category of **Cooking**.",2541,2544,
"The segment shows two people in a kitchen. One person is at the counter with groceries, and the other is at the stove. There are pots and pans on the stove, and it appears they are preparing food. Therefore, the most appropriate classification is **Cooking**.",2544,2549,
"**Cooking** 

The individuals in the video are observed preparing food, which falls under the category of cooking.",2549,2575,
"The correct category for this segment is **Cooking**.

The people in the image are in a kitchen environment, with ingredients and cooking utensils visible on the counter. They appear to be preparing food, which falls under the activity of cooking.",2575,2856," Cảm ơn các bạn đã theo dõi và hẹn gặp lại. Svartåsfärs. I think that was my bad. Các bạn nhớ đăng ký kênh để ủng hộ kênh của mình nhé. ừ ừ ừ ừ ừ ừ ừ ừ ừ ừ ừ ừ ừ ừ Cảm ơn các bạn đã theo dõi và hẹn gặp lại. Oh Oh Cái này là cái gì? Cái này là cái gì? Cái này là cái gì? Cái này là cái gì? Cái này là cái gì? Cái này là cái gì? Cái này là cái gì? Cái này là cái gì? Cái này là cái gì? Cái này là cái gì? Cái này là cái gì? Cái này là cái gì? Cái này là cái gì? Cái này là cái gì? Đúng hả? Đúng rồi, làm cái gì đó đi bà mẹ ăn thử thử Các bạn nhớ đăng ký kênh để ủng hộ kênh của mình nhé. bún này chút nữa sau đó anh buồn đó"
Cooking,2856,2867," thì để rao ra rồi, thấy có đẹp không? Mấy cái tô còn rửa Bao nhiêu tô? Mấy cái... 2 cái rửa Cái này không bỏ, đây là những cái nào? Các bạn nhớ đăng ký kênh để ủng hộ kênh lalaschool Để không bỏ lỡ những video hấp dẫn nếu mà nói thì thêm nước mắm thôi Ngon hông? Ngon đúng không? Ngon"
"The most fitting category for this image segment is **Cooking**.

Here's why:

*   **Multiple people preparing food:** The individuals are gathered around a kitchen island with various ingredients and cooking utensils. They appear to be actively engaged in food preparation.
*   **Kitchen environment:** The setting is clearly a kitchen, with a stove, countertops, and kitchenware visible.

While other activities might be happening concurrently or in related ways, the primary activity depicted is the preparation of food.",2867,2921," thì để rao ra rồi, thấy có đẹp không? Mấy cái tô còn rửa Bao nhiêu tô? Mấy cái... 2 cái rửa Cái này không bỏ, đây là những cái nào? Các bạn nhớ đăng ký kênh để ủng hộ kênh lalaschool Để không bỏ lỡ những video hấp dẫn nếu mà nói thì thêm nước mắm thôi Ngon hông? Ngon đúng không? Ngon"
**Cooking**,2921,2977, Thì đó Ngon đúng không? Ngon Ngon không? Ngon
Cooking,2977,2995,
Cooking,2995,3011,
Cooking,3011,3012,
Cooking,3012,3137, Hẹn gặp lại các bạn trong những video tiếp theo. Svartål I should have brought 50. I'm such a pig. How can you get better than a flush? Here we are. Thank you for watching! Svartålskapet Các bạn nhớ đăng ký kênh đểì của mình đang nấu vào bánh mì. Các bạn có thể nhìn thấy những cái bánh mì của mình đang nấu vào bánh mì.
"The video segment shows three people in a kitchen. One person is preparing food on an island, another is at the stove, and a third person enters the kitchen and appears to be watching or assisting. This activity is best classified as **Cooking**.",3137,3470, à à ừ ừ ừ ừ ừ ừ ừ ừ
Cooking,3470,3504,
Cooking,3504,287," Cảm ơn các bạn đã theo dõi và hẹn gặp lại. bà mẹ bán bánh mì, bà mẹ bán bánh mì, bà mẹ bán bánh mì, bà mẹ bán bánh mì, bà mẹ bán bánh mì, bà mẹ bán bánh mì, bà mẹ bán bánh mì, bà mẹ bán bánh mì, bà mẹ bán bánh mì, bà mẹ bán bánh mì, bà mẹ bán bánh mì, bà mẹ bán bánh mì, bà mẹ bán bánh mì, bà mẹ bán bánh mì, bà mẹ bán bánh mì, bà mẹ bán bánh mì, bà mẹ bán bánh mì, bà mẹ bán bánh mì, bà mẹ bán bánh mì, bà mẹ bán bánh mì, bà mẹ bán bánh mì, bà mẹ bán bánh mì, bà mẹ bán bánh mì, bà mẹ bán bánh mì, bà mẹ bán bánh mì, bà mẹ bán bánh mì, bà mẹ bán bánh mì, bà mẹ bán bánh mì, bà mẹ bán bánh mì, bà mẹ bán bánh mì, bà mẹ bán bánh mì, bà mẹ bán bánh mì, bà mẹ bán bánh mì, bà mẹ bán bánh mì, bà mẹ bán bánh mì, bà mẹ bán bánh mì, bà mẹ bán bánh mì, bà mẹ bán bánh mì, bà mẹ bán bánh mì, bà mẹ bán bánh mì, bà mẹ Cô mời các bạn xem video này và hãy đăng ký kênh để ủng hộ kênh của mình nhé. Bà bà bà bà bà bà bà bà bà bà bà bà bà bà bà bà bà bà bà bà bà bà bà bà bà bà bà bà bà bà bà bà bà bà bà bà bà bà bà bà bà bà bà bà bà bà bà bà bà bà bà bà bà bà bà bà bà bà bà bà bà bà bà bà bà bà bà bà bà bà bà bà bà bà bà bà bà bà bà bà bà bà bà bà bà bà bà bà bà bà bà bà bà bà bà bà bà bà bà bà bà bà bà bà bà bà bà bà bà bà bà bà bà bà bà bà bà bà bà bà bà bà bà bà bà bà bà bà bà bà bà bà bà bà bà bà bà bà bà bà bà bà bà bà bà bà bà bà bà bà bà bà bà bà bà bà bà bà bà bà bà bà bà bà bà bà bà bà bà bà bà bà bà bà bà bà bà bà bà bà bà bà bà bà bà bà bà bà bà bà bà bà bà bà bà bà bà bà bà bà bà bà bà bà bà bà bà bà bà bà bà bà bà bà bà bà bà bà bà bà bà bà Thì anh có thể gửi lại các đái này, cái này Cái này Nó đậu quá Không, nó đ ủng hộ kồ ăn của họ ở đây. Các bạn có thể nhìn thấy những đồ ăn của họ ở đây. Các bạn có thể nhìn thấy những đồ ăn của họ ở đây."
Cooking,287,319," Some of these are in the toilet, by the way. Stadthofen Thank you. I'm gonna sit next to Tim. Is it okay? Do you need some glasses?"
Sitting,319,331," Some of these are in the toilet, by the way. Stadthofen Thank you. I'm gonna sit next to Tim. Is it okay? Do you need some glasses?"
Talking,331,393," Also from here, right?"
Cooking,393,394," That's good. also from here right now smaller ones because otherwise the water how about orange juice? no no no but otherwise the water gets we don't have so many yeah yeah yeah close close, now. Again. Again. Okay. Let me put this in. Wait a second. There are the small ones because they should be somewhere. Better there. Because otherwise... There they are. Look. Close the line. Okay. And then I'll do this. Because otherwise we have lots of water all the time. No, no, you fill just the... But these are okay also. Yeah? Maybe these are better, yes. Hi guys. You want the glasses? One, two, three, four, five. I like the small ones because otherwise we go all the time to the water. Keep people dehydrated. Totally. What's wrong with it? Thank you for being with me today. Thank you very much. It's a personal opinion. So how does it work? You do one. It's like foam. So I take this off. And then this will pop. And then the lines will pop. No, no. It's only one. Oh, yeah. Another box. And the line is for when? We need more power. Power, yeah. Oh, but you're already..."
"The activity depicted in the image is **Cooking**. 
A man is shown in the kitchen, actively engaged in preparing food on the stovetop.",394,404," That's good. also from here right now smaller ones because otherwise the water how about orange juice? no no no but otherwise the water gets we don't have so many yeah yeah yeah close close, now. Again. Again. Okay. Let me put this in. Wait a second. There are the small ones because they should be somewhere. Better there. Because otherwise... There they are. Look. Close the line. Okay. And then I'll do this. Because otherwise we have lots of water all the time. No, no, you fill just the... But these are okay also. Yeah? Maybe these are better, yes. Hi guys. You want the glasses? One, two, three, four, five. I like the small ones because otherwise we go all the time to the water. Keep people dehydrated. Totally. What's wrong with it? Thank you for being with me today. Thank you very much. It's a personal opinion. So how does it work? You do one. It's like foam. So I take this off. And then this will pop. And then the lines will pop. No, no. It's only one. Oh, yeah. Another box. And the line is for when? We need more power. Power, yeah. Oh, but you're already..."
**Eating**,404,458," That's good. also from here right now smaller ones because otherwise the water how about orange juice? no no no but otherwise the water gets we don't have so many yeah yeah yeah close close, now. Again. Again. Okay. Let me put this in. Wait a second. There are the small ones because they should be somewhere. Better there. Because otherwise... There they are. Look. Close the line. Okay. And then I'll do this. Because otherwise we have lots of water all the time. No, no, you fill just the... But these are okay also. Yeah? Maybe these are better, yes. Hi guys. You want the glasses? One, two, three, four, five. I like the small ones because otherwise we go all the time to the water. Keep people dehydrated. Totally. What's wrong with it? Thank you for being with me today. Thank you very much. It's a personal opinion. So how does it work? You do one. It's like foam. So I take this off. And then this will pop. And then the lines will pop. No, no. It's only one. Oh, yeah. Another box. And the line is for when? We need more power. Power, yeah. Oh, but you're already..."
**Cooking**,458,479," That's good. also from here right now smaller ones because otherwise the water how about orange juice? no no no but otherwise the water gets we don't have so many yeah yeah yeah close close, now. Again. Again. Okay. Let me put this in. Wait a second. There are the small ones because they should be somewhere. Better there. Because otherwise... There they are. Look. Close the line. Okay. And then I'll do this. Because otherwise we have lots of water all the time. No, no, you fill just the... But these are okay also. Yeah? Maybe these are better, yes. Hi guys. You want the glasses? One, two, three, four, five. I like the small ones because otherwise we go all the time to the water. Keep people dehydrated. Totally. What's wrong with it? Thank you for being with me today. Thank you very much. It's a personal opinion. So how does it work? You do one. It's like foam. So I take this off. And then this will pop. And then the lines will pop. No, no. It's only one. Oh, yeah. Another box. And the line is for when? We need more power. Power, yeah. Oh, but you're already..."
"The image provided shows a kitchen with a person present. Based on the activities typically performed in a kitchen, the most fitting category from your list is **Cooking**. The presence of appliances, countertops, and what appears to be food preparation items suggests this activity.",479,815, What? No. What? um
"The man in the video is preparing food, which falls under the **Cooking** category.",815,848," I see. Make more. Yeah, you can put that in the bird's nest."
