description,start_time,end_time,transcript
Making Coffee,362,364," you you you you you you you you you you you you you you you you you Deze is een van de meest belangrijke van de kofferhuisbeelden. Okay, mine's left. Skål! I'm going to make a new one. I'm going to make a new one. I'm going to make a new one. I'm going to make a new one. I'm going to make a new one. I'm going to make a new one. I'm going to make a new one. I'm going to make a new one. I'm going to make a new one. I'm going to make a new one. I'm going to make a new one. I'm going to make a new one. I'm going to make a new one. I'm going to make a new one. I'm going to make a I'm going to make a Gå in på en kål. 1 tbs of butter Gulland, Gulland GONG 1.5 cups of water GONG I'm going to make a"
Leisure Activities,364,365," you you you you you you you you you you you you you you you you you Deze is een van de meest belangrijke van de kofferhuisbeelden. Okay, mine's left. Skål! I'm going to make a new one. I'm going to make a new one. I'm going to make a new one. I'm going to make a new one. I'm going to make a new one. I'm going to make a new one. I'm going to make a new one. I'm going to make a new one. I'm going to make a new one. I'm going to make a new one. I'm going to make a new one. I'm going to make a new one. I'm going to make a new one. I'm going to make a new one. I'm going to make a I'm going to make a Gå in på en kål. 1 tbs of butter Gulland, Gulland GONG 1.5 cups of water GONG I'm going to make a"
Making Coffee,365,385," you you you you you you you you you you you you you you you you you Deze is een van de meest belangrijke van de kofferhuisbeelden. Okay, mine's left. Skål! I'm going to make a new one. I'm going to make a new one. I'm going to make a new one. I'm going to make a new one. I'm going to make a new one. I'm going to make a new one. I'm going to make a new one. I'm going to make a new one. I'm going to make a new one. I'm going to make a new one. I'm going to make a new one. I'm going to make a new one. I'm going to make a new one. I'm going to make a new one. I'm going to make a I'm going to make a Gå in på en kål. 1 tbs of butter Gulland, Gulland GONG 1.5 cups of water GONG I'm going to make a"
Using Laptop,385,386," you you you you you you you you you you you you you you you you you Deze is een van de meest belangrijke van de kofferhuisbeelden. Okay, mine's left. Skål! I'm going to make a new one. I'm going to make a new one. I'm going to make a new one. I'm going to make a new one. I'm going to make a new one. I'm going to make a new one. I'm going to make a new one. I'm going to make a new one. I'm going to make a new one. I'm going to make a new one. I'm going to make a new one. I'm going to make a new one. I'm going to make a new one. I'm going to make a new one. I'm going to make a I'm going to make a Gå in på en kål. 1 tbs of butter Gulland, Gulland GONG 1.5 cups of water GONG I'm going to make a"
Using Laptop,386,387," you you you you you you you you you you you you you you you you you Deze is een van de meest belangrijke van de kofferhuisbeelden. Okay, mine's left. Skål! I'm going to make a new one. I'm going to make a new one. I'm going to make a new one. I'm going to make a new one. I'm going to make a new one. I'm going to make a new one. I'm going to make a new one. I'm going to make a new one. I'm going to make a new one. I'm going to make a new one. I'm going to make a new one. I'm going to make a new one. I'm going to make a new one. I'm going to make a new one. I'm going to make a I'm going to make a Gå in på en kål. 1 tbs of butter Gulland, Gulland GONG 1.5 cups of water GONG I'm going to make a"
Using Laptop,387,389," you you you you you you you you you you you you you you you you you Deze is een van de meest belangrijke van de kofferhuisbeelden. Okay, mine's left. Skål! I'm going to make a new one. I'm going to make a new one. I'm going to make a new one. I'm going to make a new one. I'm going to make a new one. I'm going to make a new one. I'm going to make a new one. I'm going to make a new one. I'm going to make a new one. I'm going to make a new one. I'm going to make a new one. I'm going to make a new one. I'm going to make a new one. I'm going to make a new one. I'm going to make a I'm going to make a Gå in på en kål. 1 tbs of butter Gulland, Gulland GONG 1.5 cups of water GONG I'm going to make a"
Using Laptop,389,390," you you you you you you you you you you you you you you you you you Deze is een van de meest belangrijke van de kofferhuisbeelden. Okay, mine's left. Skål! I'm going to make a new one. I'm going to make a new one. I'm going to make a new one. I'm going to make a new one. I'm going to make a new one. I'm going to make a new one. I'm going to make a new one. I'm going to make a new one. I'm going to make a new one. I'm going to make a new one. I'm going to make a new one. I'm going to make a new one. I'm going to make a new one. I'm going to make a new one. I'm going to make a I'm going to make a Gå in på en kål. 1 tbs of butter Gulland, Gulland GONG 1.5 cups of water GONG I'm going to make a"
Cooking,390,475," you you you you you you you you you you you you you you you you you Deze is een van de meest belangrijke van de kofferhuisbeelden. Okay, mine's left. Skål! I'm going to make a new one. I'm going to make a new one. I'm going to make a new one. I'm going to make a new one. I'm going to make a new one. I'm going to make a new one. I'm going to make a new one. I'm going to make a new one. I'm going to make a new one. I'm going to make a new one. I'm going to make a new one. I'm going to make a new one. I'm going to make a new one. I'm going to make a new one. I'm going to make a I'm going to make a Gå in på en kål. 1 tbs of butter Gulland, Gulland GONG 1.5 cups of water GONG I'm going to make a"
"The video segment shows a person preparing food in a kitchen. Therefore, the correct classification is **Cooking**.",475,597," you you you you you you you you you you you you you you you you you Deze is een van de meest belangrijke van de kofferhuisbeelden. Okay, mine's left. Skål! I'm going to make a new one. I'm going to make a new one. I'm going to make a new one. I'm going to make a new one. I'm going to make a new one. I'm going to make a new one. I'm going to make a new one. I'm going to make a new one. I'm going to make a new one. I'm going to make a new one. I'm going to make a new one. I'm going to make a new one. I'm going to make a new one. I'm going to make a new one. I'm going to make a I'm going to make a Gå in på en kål. 1 tbs of butter Gulland, Gulland GONG 1.5 cups of water GONG I'm going to make a"
Cooking,597,1459," you you you you you you you you you you you you you you you you you Deze is een van de meest belangrijke van de kofferhuisbeelden. Okay, mine's left. Skål! I'm going to make a new one. I'm going to make a new one. I'm going to make a new one. I'm going to make a new one. I'm going to make a new one. I'm going to make a new one. I'm going to make a new one. I'm going to make a new one. I'm going to make a new one. I'm going to make a new one. I'm going to make a new one. I'm going to make a new one. I'm going to make a new one. I'm going to make a new one. I'm going to make a I'm going to make a Gå in på en kål. 1 tbs of butter Gulland, Gulland GONG 1.5 cups of water GONG I'm going to make a"
**Cooking**,1459,1574, Tov. Ja. Nå er det en hel del av denne byggen. Svartål Do you take on the SD card?
Cooking,1574,1626," Und eben so, weil sonst ist es zu heiß. Vielen Dank.... und dann geht es hier rein."
"The segment shows two people in a kitchen environment. One person is preparing food on a counter, and the other person is standing nearby. The presence of food preparation and cooking utensils strongly suggests the activity is **Cooking**.",1626,1671,"... Musik... Das ist der Morgen, da ist immer die stabilste Wetterlage, weil es ist jetzt wieder trocken."
Cooking,1671,1681," Ja, das ist heiß."
"The correct category for this segment is **Cooking**.

The video shows two people in a kitchen, with one person actively preparing food at the counter and the other assisting or observing. There are ingredients and utensils visible, suggesting the process of cooking is underway.",1681,1978," Das war der Dampfhahn. Ja, ja schon. Aber es wird dann schon doch... Ja, ja schon. Aber es wird dann schon doch... Ja, schon, aber es ist dann schon doch recht nah am, is this covered? Is this last piece? Yeah. Bei dir leuchtet jetzt nichts mehr."
Talking,1978,2111,"... Musik... Die Fahne bräuchte eine aggressivere Lösung als das hier zu verhüten steht. Ja, das ist hier. Ja. Komm, pack her."
"The provided image shows two men in a kitchen. One man is standing at the kitchen island, seemingly washing dishes. The other man is standing near the oven. Based on the actions depicted, the most fitting category is **Washing dishes**.",2111,2184," So, Verweichlichung hier. Rengar Die fang ich jetzt einfach hier ein bisschen einweichen und dann fehlt eigentlich hier Okay. Das ist eigentlich eine Salauch-Schüssel."
Cooking,2184,3481," Die ist später noch. The building is now under construction. Stamford Street Storting, Storting, Storting, Storting, Storting, Storting, Storting, Storting, Storting, Storting, Storting, Storting, Storting, Storting, Storting, Storting, Storting, Storting, Storting, Storting, Storting, Storting, Storting, Storting, Storting, Storting, Storting, Storting, Storting, Storting, Storting, Storting, Storting, Storting, Storting, Storting, Storting, Storting, Storting, Storting, Storting, Storting, Storting, Storting, Storting, Storting, Storting, Storting, Storting, Storting, Storting, Storting, Storting, Storting, Storting, Storting, Storting, Storting, Storting, Storting, Storting, Storting, Storting, Storting, Storting, Storting, Storting, Storting, Storting, Storting, Storting, Storting, Storting, Storting, Storting, Storting, Storting, Storting, Storting, Storting, Storting, Storting, Storting, Storting, Storting, Storting, Storting, Storting, Storting, Storting, Storting, Storting, Storting, Storting, Storting, Storting, Storting, Storting, Storting, Storting, Storting, Storting, Storting, Storting, Storting, Storting, Storting, Storting, Storting, Storting, Storting, I'm going to make a I'm going to make a We are now at the entrance of the main entrance. The I'm going to make a I'm going to make a I'm going to make a I'm going to make a I'm going to make a Thank you for watching. We clean the dust inside the phone. We are now at the site of the construction of the new building. The building was built in 1913. It is now a residential building with a large living area. The building was built in 1913. The building was built Thank you for watching! I'm going to make a"
"**Walking** 

The person in the image is captured in motion, walking across the kitchen area. Their body is angled as if in mid-stride, and their feet are positioned for movement.",3481,3501," I'm going to make a new one. I'm going to make a new one. 1.5 kg kvartal Rrrrrrrrrrrrrrrrrrrrrrrrrrrrrrrrrrrrrrrrrrrrrrrrrrrrrrrrrrrrrrrrrrrrrrrrrrrrrrrrrrrrrrrrrrrrrrrrrrrrrrrrrrrrrrrrrrrrrrrrrrrrrrrrrrrrrrrrrrrrrrrrrrrrrrrrrrrrrrrrrrrrrrrrrrrrrrrrrrrrrrrrrrrrrrrrrrrrrrrrrrrrrrrrrrrrrrrrrrrrrrrrrrrrrrrrrrrrrrrrrrrrrrrrrrrrrrrrrrrrrrrrrrrrrrrrrrrrrrrrrrrrrrrrrrrrrrrrrrrrrrrrrrrrrrrrrrrrrrrrrrrrrrrrrrrrrrrrrrrrrrrrrrrrrrrrrrrrrrrrrrrrrrrrrrrrrrrrrrrrrrrrrrrrrrrrrrrrrrrrrrrrrrrrrrrrrrrrrrrrrrrrrrrrrrrrrrrrrrrrrrrrrrrrrrrrrrrrrrrrrrrrrrrrrrrrrrrrrrrrrrrrrrrrrrrrrrrrrrrrrrrrrrrrrrrrrrrrrrrrrrrrrrrrrrrrrrrrrrrrrrrrrrrrrrrrrrrrrrrrrrrrrrrrrrrrrrrrrrrrrrrrrrrrrrrrrrrrrrrrrrrrrrrrrrrrrrrrrrrrrrrrrrrrrrrrrrrrrrrrrrrrrrrrrrrrrrrrrrrrrrrrrrrrrrrrrrrrrrrrrrrrrrrrrrrrrrrrrrrrrrrrrrrrrrrrrrrrrrrrrrrrrrrrrrrrrrrrrrrrrrrrrrrrrrrrrrrrrrrrrrrrrrrrrrrrrrrrrrrrrrrrrrrrrrrrrrrrrrrrrrrrrrrrrrrrrrrrrrrrrrrrrrrrrrrrrrrrrrrrrrrrrrrrrrrrrrrrrrrrrrrrrrrrrrrr 1.5 kg kvartal I'm sorry. Norske Rundforskning I'm going to make a I'm going to make a The building is a small apartment complex with a large living room. I'm going to go to the bathroom. Hey, good morning."
"The provided image shows a kitchen with various items, including food, appliances, and seating. However, there is no explicit action or activity being performed by anyone in the image. Therefore, it is not possible to classify this segment into any of the given categories.",3501,3504," I'm going to make a new one. I'm going to make a new one. 1.5 kg kvartal Rrrrrrrrrrrrrrrrrrrrrrrrrrrrrrrrrrrrrrrrrrrrrrrrrrrrrrrrrrrrrrrrrrrrrrrrrrrrrrrrrrrrrrrrrrrrrrrrrrrrrrrrrrrrrrrrrrrrrrrrrrrrrrrrrrrrrrrrrrrrrrrrrrrrrrrrrrrrrrrrrrrrrrrrrrrrrrrrrrrrrrrrrrrrrrrrrrrrrrrrrrrrrrrrrrrrrrrrrrrrrrrrrrrrrrrrrrrrrrrrrrrrrrrrrrrrrrrrrrrrrrrrrrrrrrrrrrrrrrrrrrrrrrrrrrrrrrrrrrrrrrrrrrrrrrrrrrrrrrrrrrrrrrrrrrrrrrrrrrrrrrrrrrrrrrrrrrrrrrrrrrrrrrrrrrrrrrrrrrrrrrrrrrrrrrrrrrrrrrrrrrrrrrrrrrrrrrrrrrrrrrrrrrrrrrrrrrrrrrrrrrrrrrrrrrrrrrrrrrrrrrrrrrrrrrrrrrrrrrrrrrrrrrrrrrrrrrrrrrrrrrrrrrrrrrrrrrrrrrrrrrrrrrrrrrrrrrrrrrrrrrrrrrrrrrrrrrrrrrrrrrrrrrrrrrrrrrrrrrrrrrrrrrrrrrrrrrrrrrrrrrrrrrrrrrrrrrrrrrrrrrrrrrrrrrrrrrrrrrrrrrrrrrrrrrrrrrrrrrrrrrrrrrrrrrrrrrrrrrrrrrrrrrrrrrrrrrrrrrrrrrrrrrrrrrrrrrrrrrrrrrrrrrrrrrrrrrrrrrrrrrrrrrrrrrrrrrrrrrrrrrrrrrrrrrrrrrrrrrrrrrrrrrrrrrrrrrrrrrrrrrrrrrrrrrrrrrrrrrrrrrrrrrrrrrrrrrrrrrrrrrrrrrrrrrrrrrrrrrrrrrrrrrrrrrrr 1.5 kg kvartal I'm sorry. Norske Rundforskning I'm going to make a I'm going to make a The building is a small apartment complex with a large living room. I'm going to go to the bathroom. Hey, good morning."
Cooking,3504,28," How's life, baby? So far so good. You tidied up the kitchen, right? Yesterday. Do you know where the rest of these are? So let me first attach the sensors. Today we start at 10. Well, the workshop starts at 10. Ah, shit. Then I have to prepare breakfast now. Okay. No, Carl told me prepare workshop yeah something something there was much more of this oh yeah yeah totally you know where they are I have no idea I showed you but I think you're hyper focused on it. Yes. Like just I told you very easy. I think you were busy with... I may have been busy with various things. It seemed to me that you have semi look in my direction but you were probably just... Yeah. Thanks everybody. Do you have any idea where the chocolate went? There was cacao powder. Oh yeah, that one I've seen. And also dark chocolate. Dark chocolate I don't know, but cacao could be sour. Yeah. Let me check."
Washing dishes,28,68," probably no once I find all the ingredients very sticky I am thank you much I Very tasty. Well, in this station it's very cinnamon-y. So, Luca. Where is the first-class-class-class? Um, on the, uh... counter? Next to the clock at the entry. So I make it clean. So this one, is it clean? No, it's not so clean."
Washing dishes,68,281," Alright, very good. Gullit I have not understood the word of what you've been saying."
Cooking,281,540," Ok. Now we sink. Key. This guy is happening. Lots of hours. Let me try to find. Baking cocoa. Baking cocoa. So in absence of... No, there was one. I saw it. Sorry I'm... We brought one. It's in Moscow somewhere. Yeah, it's here somewhere. Yeah, there it is. Ah, thank you very much. Pretty much, you know, like classic pick and placeisi klasīgi, kā tas, kādā vietā, tas ir jāsaka. Jā, jā. Jā, jā, jā. Jā, jā, jā. Jā, jā, jā. Jā, jā, jā. Jā, jā, jā. Jā, jā, jā, jā. Jā, jā, jā, jā. Jā, jð er ekki það. Hvornir þau komir frá stórn? Hvornir þau komir frá stórn? Þau fyrir Þau fyrir áttu áttu áttu áttu. Ég finn að þau fyrir áttu áttu áttu áttu áttu áttu. Ég hef ekki ekki ekki ekki ekki ekki ekki ekki ekki ekki ekki ekki ekki ekki ekki ekki ekki ekki ekki ekki ekki ekki ekki ekki ekki ekki ekki ekki ekki ekki ekki ekki ekki ekki ekki ekki ekki ekki ekki ekki ekki ekki ekki ekki ekki ekki ekki ekki ekki ekki ekki ekki ekki ekki ekki ekki ekki ekki ekki ekki ekki ekki ekki ekki ekki ekki ekki ekki ekki ekki ekki ekki ekki ekki ekki ekki ekki ekki ekki ekki ekki ekki ekki ekki ekki ekki ekki ekki ekki ekki ekki ekki ekki ekki ekki ekki ekki ekki ekki ekki ekki ekki ekki ekki ekki ekki ekki ekki ekki ekki ekki ekki ekki ekki ekki ekki ekki ekki ekki ekki ekki ekki ekki ekki ekki ekki ekki ekki ekki ekki ekki ekki ekki ekki ekki ekki ekki ekki ekki ekki ekki ekki ekki ekki ekki ekki ekki ekki ekki ekki ekki ekki ekki ekki ekki ekki ekki ekki ekki ekki ekki ekki ekki ekki ekki ekki ekki ekki ekki ekki ekki ekki ekki ekki ekki ekki ekki ekki ekki ekki ekki ekki ekki ekki ekki ekki ekki ekki ekki ekki ekki ekki ekki ekki ekki ekki ekki ekki ekki ekki ekki ekki ekki ekki ekki ekki ekki ekki ekki ekki ekki ekki ekki ekki ekki ekki ekki ekki ekki ekki Depends how fast they are. Probably, I would probably get them in another half an hour or so."
The segment is classified as **Cooking**.,540,775," So we have everything for the first one ready. I guess It's in a fridge. So this is second and you have a third Your first is in the fridge, this is the second and then you have this Okay It's like ghosts of girlfriends past There are three What trees. What? Joke. There are these cheesy Hollywood movies. Yeah. I have no idea. There are some of these Christmas stories or something. Okay. About ghosts and stuff. Ghosts. Uh-huh. And if I remember correctly, they come in trees. Well, we have the original somewhere over there. The Christmas Carol. Ah, that's the one. I'm an orthodox, we don't have Christmas carols. Ehh. So, classical literature is strictly forbidden?"
"The most fitting category for this segment is **Cooking**. The individuals in the video are actively preparing food in a kitchen setting, which is indicative of the cooking process.",775,2612," kind of microwaves i think i use this yep Gå inn på fjellet. Torsdagsbladet Dabūj svarbēt, dabūj svarbēt, dabūj svarbēt"
Cooking,2612,722," In the group we have on the science park in Malta, occasionally, this presentation, meaning every week we have presentations, but in a different format. Normally PhDs present their work, every once in a while they present something else, you know, like of interest for everybody. Hey, you know, how do we use servers how do we use super computers kind of go about data transfer efficiently so they really made a good presentation two of them then I looked at rsync and I was like wait a second it's rsync azv I heard like it looks. It was the last time I saw it. That was for compression on these very slow lines. We used to use that. And you do know what happens if you use AVZ on images and videos and our data sets are crazy. Imagine if you try to move. No, this is not helpful. That's basically... I'm not sure, but it may even slow it down. Yes, it... well, in many cases it will actually slow it down. So that was very funny. But apparently these online tutorials, GitHub, Stack Overflow, so Google and so on, actually just still use that flag somewhere. Do you think you can transfer it? Well, I mean, if you have large text files. Yes, totally. But in our community, what are we transferring? Images, videos? Yeah, some metadata or something that will not be easily compressible that didn't work meaning yes some metadata"
Cooking,722,778," and I didn't know the number ice cream. Yeah. So, do you have coffee? Anyone want more coffee? Because I'm upset about the spread running. I'll just cook another one to wake up. is this strong coffee or maybe i shouldn't be doing too much, no? yes one i made so it's stronger than cows did you take one or this is your first? i used to be in the top now i take one and a half okay, but i'm i'm kind of used to it so sometimes you know why do i need more lime? You like this? okay Oh, you are a good cook. So if I don't do the dead coffee, that's like... Yeah, today. With Ali. Because Ali is the GoPro. That's the shampoo for the phone. What? Do you want some of this? Can you see if somebody's important called? Rooster. Sorry, Harry. No, it's fine. I need a cleaner. Do you have a fridge here? No. No, it's in the other room. What? Yeah. For the egg. Yeah, it's for the egg. Yeah, but you don't want to put them in the other fridge? Yeah. First, yeah. Yeah. Fancy. If you have it for a short time, it's fine, yeah? Yeah. Put it in. Okay. Yeah. Yeah. Okay. Okay. fridge anybody want towels washed I'm gonna wash towels on camera"
Talking,778,1288," so that's the frozen spinach. Yeah, Bas was very worried about the spinach, so he put it into the freezer. Yeah, yeah. So it's still frozen? Yes, it. Still frozen? Very good. Confirmed. And there are two of these croissants are maple something. They only have ten. You cleared out the regular croissants completely. Okay, then we have enough I guess. I think we also finished all of the water because Stefan was worried that actually it turned out we have two of those croissants for everyone and he has those, so we have more than enough right, right, yeah I was saying, thanks would be kind yeah we had real coffee we had real coffee we had barbeque? It just struck me. What? We are going to make the news. You know why? If any crazy sees this dataset and sees us coming there and turn on camera to synchronize with this QR code, you know what's going to happen? They are going to have a TV. That's it. They are coming to synchronize chip in a brain and vaccine content"
Making Coffee,1288,1323," Come on guys, there was no pineapple left. You have to go bananas. It's good to remove that, Kahal, remove that shampoo from the kitchen. Somebody's gonna mistake it as a topping for pancakes. Did you get a shampoo? Boss, did he get a shampoo? I bought three shampoos. What was for him? Stefan, pay attention. Is that 12 seconds? Did you get a shampoo? Yeah, yeah, yeah. Okay, wait. Uh... No, it's happening now. You both use the food. Yeah, yeah, yeah. Oh, yeah, yeah. I'll check, I'll check, I'll check. No, but I think in the supermarket, did you? Yeah. Did you choose that? Choose what? The bananas? Oh, no, no, no. You chose that. Okay. Why don't you? This is a big deal. Coconut and banana. Okay. I think coconut or banana. Coconut. Put it in your pocket. Thank you. But it's awesome. Oh. Four Romans. ones are with degrees i'm assuming these are zero to six degrees because it was so so weak Okay, there is no concrete just for keeping food warm yes it might be your i made a mistake i went to the room but uh i guess it's okay did you ever go no if you managed to i went to the room by mistake there is nothing that is looking embarrassing you mean with the video yeah i did that too yeah sure if you would not be lying around in your room? If you didn't look at your hostages, then you're okay. Does anybody want a towel washed? No, wait a second. Do we have a cloth? No, we have flour. No, no, no. Take a tablecloth. Give me a towel. Alright, I'll take a kitchen towel. Do we need to prepare more coffee? Yes, I need someone to bring me that one. This thing is very heavy. I'll wash it. Just that? Yes, I already made that. I'll wash it. You got your own, you got your own. Yeah, oh. But you know what's weird? What? These right ones are done. Right and the left ones too much. And the left ones not near close. Sorry. Thank you. And then we'll come over. Look at this. How is this possible? I set them the same, I think. Well. This is incredible ones are all done and I was looking from there these and they are not even in the right kind of way. Exactly, that's what I said. That one is useless. Sure, they will be over. So let me just decrease this one a little bit. It's too much. Is this okay? What? Is this okay? There's a towel service happening this morning. I would like that. Just because my towels are so damp and they're not drying properly. Go for it. You're on camera. Look at this. Look at this. They're not even breathing and this one's over the water. I don't know what's in the water."
"The most fitting category for this segment is **Cooking**. 

The video shows a group of people gathered in a kitchen environment. Several individuals are actively engaged in tasks associated with food preparation, such as standing at the stove, handling ingredients, and interacting with cooking appliances. This scene strongly suggests a cooking activity.",1323,2114," Is my camera working? Yes. I'll bring my towels. Yeah, I trust you. Anybody else want a towel wash? I think just a cold brew. Where's a cold brew? No, that's enough. Nobody wants towels washed. Where do I bring the towel? To me 14 mark. We got the 14 mark."
"The provided image shows a person walking in a kitchen. Therefore, the correct classification for this segment is **Walking**.",2114,2175,
Unclear,2175,2177,
Walking,2177,2179,
