description,start_time,end_time,transcript
"The provided images depict two individuals in a kitchen environment, engaged in activities related to food preparation. One person is holding a cutting board with broccoli, suggesting they are actively involved in chopping or preparing ingredients. The presence of kitchen appliances, countertops, and food items further reinforces the context of cooking. Therefore, the most appropriate classification for this segment is **Cooking**.",1333,1429," à à anh luôn anh ai hiểu không anh có thể luôn à em biết được không Các bạn có thể nhìn thấy những đường đường này ở đây. Các bạn có thể nhìn thấy những đường đường này ở đây. Các bạn có thể nhìn thấy những đường đường này ở đây. Oh my god I hope this one comes on camera. Các bạn có thể nhìn thấy những cái bạn video này trên kênh youtube của chúng tôi. Các bạn có thể nhìn thấy đường đường này ở phía bên, đường đường này ở phía bên. Các bạn có thể nhìn thấy đường đường này ở phía bên, đường đường này ở phía bên. Các bạn có thể nhìn thấy những đồ chơi của mình ở đây. Thank you. Nå er vi på Norske Norske This is the first time I've seen this kind of food. It's a very popular dish in Vietnam. It's a very popular dish in Vietnam. It's a very popular dish in Vietnam. It's a very popular dish in Vietnam. I'm going to eat the rest of the food. The The Norske Stadion I'm not sure if you can see it, but I'm think it's okay. Try it. It just needs to warm up. I'll turn off the valve."
"The provided video segment shows people actively engaged in preparing food, chopping vegetables, and using kitchen appliances. Therefore, the most fitting category is **Cooking**.",1429,1482," à à anh luôn anh ai hiểu không anh có thể luôn à em biết được không Các bạn có thể nhìn thấy những đường đường này ở đây. Các bạn có thể nhìn thấy những đường đường này ở đây. Các bạn có thể nhìn thấy những đường đường này ở đây. Oh my god I hope this one comes on camera. Các bạn có thể nhìn thấy những cái bạn video này trên kênh youtube của chúng tôi. Các bạn có thể nhìn thấy đường đường này ở phía bên, đường đường này ở phía bên. Các bạn có thể nhìn thấy đường đường này ở phía bên, đường đường này ở phía bên. Các bạn có thể nhìn thấy những đồ chơi của mình ở đây. Thank you. Nå er vi på Norske Norske This is the first time I've seen this kind of food. It's a very popular dish in Vietnam. It's a very popular dish in Vietnam. It's a very popular dish in Vietnam. It's a very popular dish in Vietnam. I'm going to eat the rest of the food. The The Norske Stadion I'm not sure if you can see it, but I'm think it's okay. Try it. It just needs to warm up. I'll turn off the valve."
Cooking,1482,1486," à à anh luôn anh ai hiểu không anh có thể luôn à em biết được không Các bạn có thể nhìn thấy những đường đường này ở đây. Các bạn có thể nhìn thấy những đường đường này ở đây. Các bạn có thể nhìn thấy những đường đường này ở đây. Oh my god I hope this one comes on camera. Các bạn có thể nhìn thấy những cái bạn video này trên kênh youtube của chúng tôi. Các bạn có thể nhìn thấy đường đường này ở phía bên, đường đường này ở phía bên. Các bạn có thể nhìn thấy đường đường này ở phía bên, đường đường này ở phía bên. Các bạn có thể nhìn thấy những đồ chơi của mình ở đây. Thank you. Nå er vi på Norske Norske This is the first time I've seen this kind of food. It's a very popular dish in Vietnam. It's a very popular dish in Vietnam. It's a very popular dish in Vietnam. It's a very popular dish in Vietnam. I'm going to eat the rest of the food. The The Norske Stadion I'm not sure if you can see it, but I'm think it's okay. Try it. It just needs to warm up. I'll turn off the valve."
The classification for this segment is **Cooking**.,1486,1493," à à anh luôn anh ai hiểu không anh có thể luôn à em biết được không Các bạn có thể nhìn thấy những đường đường này ở đây. Các bạn có thể nhìn thấy những đường đường này ở đây. Các bạn có thể nhìn thấy những đường đường này ở đây. Oh my god I hope this one comes on camera. Các bạn có thể nhìn thấy những cái bạn video này trên kênh youtube của chúng tôi. Các bạn có thể nhìn thấy đường đường này ở phía bên, đường đường này ở phía bên. Các bạn có thể nhìn thấy đường đường này ở phía bên, đường đường này ở phía bên. Các bạn có thể nhìn thấy những đồ chơi của mình ở đây. Thank you. Nå er vi på Norske Norske This is the first time I've seen this kind of food. It's a very popular dish in Vietnam. It's a very popular dish in Vietnam. It's a very popular dish in Vietnam. It's a very popular dish in Vietnam. I'm going to eat the rest of the food. The The Norske Stadion I'm not sure if you can see it, but I'm think it's okay. Try it. It just needs to warm up. I'll turn off the valve."
"The image shows a person in a kitchen, actively engaged in preparing food. They are standing at a kitchen island with various ingredients and utensils visible, and appear to be cooking. Therefore, the most appropriate classification is **Cooking**.",1493,1520," à à anh luôn anh ai hiểu không anh có thể luôn à em biết được không Các bạn có thể nhìn thấy những đường đường này ở đây. Các bạn có thể nhìn thấy những đường đường này ở đây. Các bạn có thể nhìn thấy những đường đường này ở đây. Oh my god I hope this one comes on camera. Các bạn có thể nhìn thấy những cái bạn video này trên kênh youtube của chúng tôi. Các bạn có thể nhìn thấy đường đường này ở phía bên, đường đường này ở phía bên. Các bạn có thể nhìn thấy đường đường này ở phía bên, đường đường này ở phía bên. Các bạn có thể nhìn thấy những đồ chơi của mình ở đây. Thank you. Nå er vi på Norske Norske This is the first time I've seen this kind of food. It's a very popular dish in Vietnam. It's a very popular dish in Vietnam. It's a very popular dish in Vietnam. It's a very popular dish in Vietnam. I'm going to eat the rest of the food. The The Norske Stadion I'm not sure if you can see it, but I'm think it's okay. Try it. It just needs to warm up. I'll turn off the valve."
Cooking,1520,1571," à à anh luôn anh ai hiểu không anh có thể luôn à em biết được không Các bạn có thể nhìn thấy những đường đường này ở đây. Các bạn có thể nhìn thấy những đường đường này ở đây. Các bạn có thể nhìn thấy những đường đường này ở đây. Oh my god I hope this one comes on camera. Các bạn có thể nhìn thấy những cái bạn video này trên kênh youtube của chúng tôi. Các bạn có thể nhìn thấy đường đường này ở phía bên, đường đường này ở phía bên. Các bạn có thể nhìn thấy đường đường này ở phía bên, đường đường này ở phía bên. Các bạn có thể nhìn thấy những đồ chơi của mình ở đây. Thank you. Nå er vi på Norske Norske This is the first time I've seen this kind of food. It's a very popular dish in Vietnam. It's a very popular dish in Vietnam. It's a very popular dish in Vietnam. It's a very popular dish in Vietnam. I'm going to eat the rest of the food. The The Norske Stadion I'm not sure if you can see it, but I'm think it's okay. Try it. It just needs to warm up. I'll turn off the valve."
"The image depicts a kitchen scene with food preparation evident. Several elements suggest cooking activity:

* **Ingredients and Utensils:** The countertop is covered with various ingredients, cutting boards, knives, and other kitchen tools, indicating that food is being prepared.
* **Stove and Oven:** The stove and oven are visible and appear to be in use or recently used, with pots and pans on them.
* **Food on Countertops:** Prepared food items are spread across the countertops.

Therefore, the most appropriate classification for this segment is **Cooking**.",1571,1621," à à anh luôn anh ai hiểu không anh có thể luôn à em biết được không Các bạn có thể nhìn thấy những đường đường này ở đây. Các bạn có thể nhìn thấy những đường đường này ở đây. Các bạn có thể nhìn thấy những đường đường này ở đây. Oh my god I hope this one comes on camera. Các bạn có thể nhìn thấy những cái bạn video này trên kênh youtube của chúng tôi. Các bạn có thể nhìn thấy đường đường này ở phía bên, đường đường này ở phía bên. Các bạn có thể nhìn thấy đường đường này ở phía bên, đường đường này ở phía bên. Các bạn có thể nhìn thấy những đồ chơi của mình ở đây. Thank you. Nå er vi på Norske Norske This is the first time I've seen this kind of food. It's a very popular dish in Vietnam. It's a very popular dish in Vietnam. It's a very popular dish in Vietnam. It's a very popular dish in Vietnam. I'm going to eat the rest of the food. The The Norske Stadion I'm not sure if you can see it, but I'm think it's okay. Try it. It just needs to warm up. I'll turn off the valve."
"The video segment depicts individuals engaged in the preparation of food, evident from the presence of ingredients, cooking utensils, and the oven being used. Therefore, the most appropriate classification for this segment is **Cooking**.",1621,1671, Shall we? Let me put the posters because we're thinking to let it stand until we serve. sure I think it potatoes are just dense. There are types of potatoes that are almost impossible to cook. I think this is more of a chip potato. How long did they cook it for? It's an hour hour now I don't think this one will get mushy either
Cooking,1671,1673," so, yeah"
"The correct category for this segment is **Cooking**.

The image shows several people in a kitchen environment, with some actively engaged in food preparation activities like chopping vegetables and working near the stove.",1673,1833, I would say an hour
Cooking,1833,1880, what we have?
Talking,1880,1994," this one is okay All right. All right. Where is the camp washing thing? There's one in the bathroom, right? Yep. Ah."
Leisure Activities,1994,2007,
Cooking,2007,2081,
Leisure Activities,2081,2095,
"The video segment shows a person in a kitchen preparing food. The person is standing at the stove, actively engaged in the process of cooking. This aligns with the category of **Cooking**.",2095,2141,
Leisure Activities,2141,2173,
Leisure Activities,2173,2605," Thank you. Det är för att få med kraft. Aaaah! Vatten? Jo. Det är för att få med kraft. Det är ju för att få med kraft. Det är ju för att få med kraft. Det är ju för att få med kraft. Det är ju för att få med kraft. Det är ju för att få med kraft. Det är ju för att få med kraft. Det är ju för att få med kraft. Det är ju för att få med k is lemon. We've been cooking for a long time. Yes. When did we start chopping? I think we started chopping at six something. Six? Because it's seven of all these mushrooms. Mushrooms? You can call this one. Yeah. Bring your eggs. Yes. Good. I'm doing my eggs. I don't want to see you not eating anymore. So please put rice. Put one of each on the side. Put a little piece of... I don't know what it's called. Put a little piece of... Coriander on top if you want. So do you. Eat them separately, basically. These are two different dishes. Leave them separately? Yes, yes. They will not be mixed. Both will? Rice? Rice? Rice? I Would you like to have this? Sure. So it's one of your prices per preference. Yes, please. So it's not recording. You do whatever, and then see if it's something. Na the side. So we have a separate one each day, right? I don't make the pasta at all. So it's the right thing to take a piece of all. Yeah, yeah, yeah. Can you give me a bit of that? Who is this? This one. You may do well tomorrow. That's 4 hours and 43. What? 4 hours and 43. That's 4 hours and 43 minutes left. That is not correct. It probably didn't record. That means that it did not record? Thanks, yes. Thank you. How would I know what you did with it? How is it put? If you want to get food, you can pass the plate. Oh, no, no, it says 2 hours 58. I'll have it better. Well, not that much better, yeah. I thought I was asking you. Which one is coriander? I'm aware of the coriander. No, I don't think, I guess, nobody here has that. It must have like a very large amount of nutrition. Yeah. It would be really hard to do. Right. OK. Is everybody one line, half line? Excellent. Long Press The Press The Press The Press The Press The Press Thank you. Svartålskog The building is now a museum. like 50 years. Is it possible? No, he just has a very bad memory from being in the 70s. Oh, no, excuse me. I'm not that old. I did not forget who I remember your name. No, no, no. So, what does he call everyone? Just whatever the first thing that comes to mind. He called me crazy. Really? Yes. I have 12 hours. What? I have 12 hours. Why? I'm 12. And occasionally I have ground-to-ground-tis-hours. Ground-to-ground-tis-hours? Yes. That's when he's particularly happy. Evil gangster. No, no, no. Not gangster. Gangsta. Gangsta. Evil gangster. I don't know. She was asking me, what do you call the gangster? You know, like, and I'm just like keeping up some of the fence for a breakfast, and all of a sudden I noticed they had gone. Was it Kevin? Ganse, did you? She's like, she needs to do something. Oh, okay. Should we go to the bar or not? Why? Why not? We need to order breakfast. Yes. What's wrong with you? Wow. Yes. Wait. Are you really like this? We have dinner and we go again. We don't drink anything. I think the answer to your question is yes. I don't get all about how you can handle it. You also pay for this. Also, you can go back to other people. There have been a thousand devices recording your safety. It will be difficult to retract. But the cameras are off. It depends if you come back early enough, then it says go. Which means if he does not come back early, the cameras will know through absence. So if the cameras are off, then you haven't come come back here but you don't touch the cameras they will come to your room right? I do back early without drinking anything, you'll climb out of the window, and then you'll go back to the bar. There you go. Is this what you did yesterday? I wish I wouldn't have left the window open. No. I wanted to pass whatever hour. I come down and there's a door not locked. I will lock the door. I wanted to pass whatever hour. Today I was two feet behind the floor and I somehow woke up and I didn't realize what it was and until I realized I heard that there was already... The first time you ran I integrated it very smoothly into my brain. I suppose. Oh, you ran twice? I only ran twice. I suspect three times but at least twice. The second time I'm not sure. Maybe it was one of them twice. I think it was three times. So in between I went around the house again, looking for any window that would have better light. I was preparing to spend the night outside. You can build our house. Yeah, the other house is over here oh wait I just assumed you were watching I just assumed you were watching you should be yeah, assumptions Maybe you bring the coriander? I wrote it to make myself."
Cooking,2605,2607, I donly remember we discussed which ones we're supposed to get. I don't remember that. But there was a conversation we discussed in that exercise. Maybe someone used to get them. There is a man-written...
Cooking,2607,2611,
"**Cooking**

**Reasoning:**

The image clearly shows several individuals engaged in activities associated with cooking:

*   **Food Preparation:** One person is holding a baking tray with what appears to be cupcakes or muffins, suggesting they are involved in baking.
*   **Stovetop Activity:** Another person is standing at the stove, which is a central point for cooking.
*   **Kitchen Environment:** The scene is set in a kitchen, with appliances like an oven and stovetop visible, along with various food items and utensils.
*   **General Activity:** The overall atmosphere depicts a group of people actively preparing food.",2611,2617,
Cooking,2617,2619,
"The most fitting category for this image segment is **Cooking**. 

Several people are actively engaged in food preparation, with ingredients and cooking utensils visible on the kitchen island and countertops. The presence of a stove and oven further reinforces this classification.",2619,2660," Hey guys Oh, I don't know. People were looking for the jerrys. Did not find them? No. Interesting."
"The most fitting category for this segment is **Cooking**.

Here's why:
*   The main action depicted is a person actively engaged in food preparation at the kitchen counter.
*   There are ingredients, utensils, and cooking appliances visible, all indicative of cooking.",2660,2673, You know I get the problem.
**Walking**,2673,2677, You know I get the problem.
Cooking,2677,2679, You know I get the problem.
Serving Food,2679,2762, You know I get the problem.
**Cooking**,2762,2964," Yes, so it's high pressure unfortunately So that's tomorrow for lunch? Friday, probably Oh yes, you want to put some lamb inside? Did we ever find out? Did we ever find out who sent the lamb? I don't know, but somebody sent me to buy lamb yeah i said because the list said means"
The person in the video is **Cooking**.,2964,3037," Yeah. Spicy in general. Spicy, yeah. Spicy, yeah. Yeah, well, you're living in Norway. Really spicy. Except for me, this is not spicy. This is like a flavor. I don't like it. I don't want it spicy. But I really like it. Even if it's spicy. Yeah? Yes. Yeah, it's completely done. It's become one with the rest of us. Oh, okay, okay, okay. You look very... I'm explaining our testimony. I'm explaining our testimony. I'm explaining our testimony. Yeah, exactly. It is freaking... It's just... What. Oh, come on. What I think."
Cooking,3037,3093, We want to go.
"The image shows two people in a kitchen. One person is standing and holding something in their hand, while the other person is standing and looking at a cutting board. There are various kitchen items on the counter, including pots, pans, and utensils. The overall scene suggests that the individuals are engaged in food preparation. Therefore, the most appropriate category is **Cooking**.",3093,3094,
"The person in the image is standing at a kitchen island with food on it and appears to be preparing it. Therefore, the activity is best classified as **Cooking**.",3094,3330," Terima kasih telah menonton! I don't know. I don't know. I don't know. I don't know. We can just do this, I think. And then I will lecture them. But the exchange rate of opera regular period. So every second. What was it after the first one? Just after the first one and then I die. Oh, maybe. No, no, no. So you don't have to. They had this. You have this, you want to see how it happened? This blue one? This one? That was the very first one. Before things started. After the base. Okay. Just that one. Oh, yeah, yeah, yeah. I think these wheels are a bit, maybe you took an empty stomach. We had a tasting party, right? Yes. Tasting party. They're untreated also, right? Yes. If you took two pints of these, some IPAs are like 9%... No, but I mean, they didn't drink that much. But they're untreated also. They're also unfiltered, yes. So like this is... So I stopped at the bathroom for like... A, so two of these A. two of these are like 3 or 4 regular beef. But that means that they are a little bit less pure somehow. So they may be green as well. Color, taste. So then I had to remember? That was the point. I don't know. I remember having a shoot there. I don't remember. If you saw me, I was. You have a very good constitution, I think, for eating. Oh, yeah. I... Yes, I think I remember. Generally, you know, like it happened in most conferences. Do you remember once? Yeah. In Bangkok, second time, you know, you had to go to the hospital. You had to go to the hospital. You had to go to the hospital. You had to go to the hospital. You had to go to the hospital. You had to go to the hospital. You had to go to the hospital. You had to go to the hospital. You had to go to the hospital. You had to go to the hospital. You had to go to the hospital. You had to go to the hospital. You had to go to the hospital. You had to go to the hospital. You had to go to the hospital. You had to go to the hospital. You had to go to the hospital. You had to go to the hospital. I needed to put this powder in this litter and I wanted to tie my team up. Oh my god, I took this litter and I told him this is your power. I gave him to put this power in this litter and I want you to read code."
"The image shows a kitchen with food on the island and a stove, suggesting that the activity taking place is **Cooking**.",3330,3365," We don't know what was inside but it looked a little bit like that. That's the crazy stuff man. I had a glass and I remember the things you said, as much as possible. You drink water like it's your drink. Do you remember? It's a full time job,'s your... Do you remember? Do you remember? It's full time job, you know that. Did you ask me? Oh, Klaus, you're not sick? No. You can surprise me. Oh, you know what, because somebody told me that Klaus... Yes, and it turned out it was Klaus Jung. From Berlin. He was the same person with me at the harvest, who went in before else and had an entire pot there of cured meats. Before everybody else came in. I put myself in because Jung had the same thickness. So we think we made a lot of money. It was very nice cured meats. So he took care of it. We sacrificed ourselves. How was it? Pure wheat. How about pure wheat? Why would you eat that on a beach? Exactly. One of the third world's best. You think? Until the next one. Until 2027 in Siem Reap. Yes. Are you ready for 2027? Yes. Siem Reap. Biggest Hindu temple in the world. It's beautiful. And then the corner there is water from everywhere. It should be water from everywhere. And the same thing. Composting the Africa in my mind right now. The same thing. And then we have this. Okay. Basically I flew over that area. From Bangkok to the city. Korea. This is 27. This is 27. 26 is probably. There is another bottle of... There is another red wine out there. There is another red wine. There's another red wine? But it's for malt wine, right? No, no. For drinking? I need it anyway, three bottles. I need a bottle of white for tomorrow, I don't care. I need a bottle of that one, right? I don't know. So let's, let's go, let's go. tomorrow"
Talking,3365,3370," We don't know what was inside but it looked a little bit like that. That's the crazy stuff man. I had a glass and I remember the things you said, as much as possible. You drink water like it's your drink. Do you remember? It's a full time job,'s your... Do you remember? Do you remember? It's full time job, you know that. Did you ask me? Oh, Klaus, you're not sick? No. You can surprise me. Oh, you know what, because somebody told me that Klaus... Yes, and it turned out it was Klaus Jung. From Berlin. He was the same person with me at the harvest, who went in before else and had an entire pot there of cured meats. Before everybody else came in. I put myself in because Jung had the same thickness. So we think we made a lot of money. It was very nice cured meats. So he took care of it. We sacrificed ourselves. How was it? Pure wheat. How about pure wheat? Why would you eat that on a beach? Exactly. One of the third world's best. You think? Until the next one. Until 2027 in Siem Reap. Yes. Are you ready for 2027? Yes. Siem Reap. Biggest Hindu temple in the world. It's beautiful. And then the corner there is water from everywhere. It should be water from everywhere. And the same thing. Composting the Africa in my mind right now. The same thing. And then we have this. Okay. Basically I flew over that area. From Bangkok to the city. Korea. This is 27. This is 27. 26 is probably. There is another bottle of... There is another red wine out there. There is another red wine. There's another red wine? But it's for malt wine, right? No, no. For drinking? I need it anyway, three bottles. I need a bottle of white for tomorrow, I don't care. I need a bottle of that one, right? I don't know. So let's, let's go, let's go. tomorrow"
