description,start_time,end_time,transcript
Walking,2489,2536," Thank you for watching. The building is now a public library. Storbritannia Thank you for watching! Neko-Kichi, Neko-Kichi, Neko-Kichi, Neko-Kichi, Neko-Kichi, Neko-Kichi, Neko-Kichi, Neko-Kichi, Neko-Kichi, Neko-Kichi, Neko-Kichi, Neko-Kichi, Neko-Kichi, Neko-Kichi, Neko-Kichi, Neko-Kichi, Neko-Kichi, Neko-Kichi, Neko-Kichi, Neko-Kichi, Neko-Kichi, Neko-Kichi, Neko-Kichi, Neko-Kichi, Neko-Kichi, Neko-Kichi, Neko-Kichi, Neko-Kichi, Neko-Kichi, Neko-Kichi, Neko-Kichi, Neko-Kichi, Neko-Kichi, Neko-Kichi, Neko-Kichi, Neko-Kichi, Neko-Kichi, Neko-Kichi, Neko-Kichi, Neko-Kichi, Neko-Kichi, Neko-Kichi, Neko-Kichi, Neko-Kichi, Neko-Kichi, Neko-Kichi, Neko-Kichi, Neko-Kichi, Neko-Kichi, Neko-Kichi, Neko-Kichi, Neko-Kichi, Neko-Kichi, Neko-Kichi, Neko-Kichi, Neko-Kichi, Neko-Kichi, Neko-Kichi, Neko-Kichi, Neko-Kichi, Neko-Kichi, Neko-Kichi, Neko-Kichi, Neko-Kichi, Neko-Kichi, Neko-Kichi, Neko-Kichi, Neko-Kichi, Neko-Kichi, Neko-Kichi, Neko-Kichi, Neko-Kichi, Neko-Kichi, Neko-Kichi, you're so cute! Narae Station Norske Norske Storbritannia Norske Norske Neko-Kichi, I'm sorry for the noise. Rengar Nettopi I'm going to take a walk around the park. Nettopi I'm going to show you the inside of the building. Norske Norske Narae Station Norske Nya, Nya, Nya, Nya, Nya, Nya, Nya, Nya, Nya, Nya, Nya, Nya, Nya, Nya, Nya, Nya, Nya, Nya, Nya, Nya, Nya, Nya, Nya, Nya, Nya, Nya, Nya, Nya, Nya, Nya, Nya, Nya, Nya, Nya, Nya, Nya, Nya, Nya, Nya, Nya, Nya, Nya, Nya, Nya, Nya, Nya, Nya, Nya, Nya, Nya, Nya, Nya, Nya, Nya, Nya, Nya, Nya, Nya, Nya, Nya, Nya, Nya, Nya, Nya, Nya, Nya, Nya, Nya, Nya, Nya, Nya, Nya, Nya, Nya, Nya, Nya, Nya, Nya, Nya, Nya, Nya, Nya, Nya, Nya, Nya, Nya, Nya, Nya, Nya, Nya, Nya, Nya, Nya, Nya, Nya, Nya, Nya, Nya, Nya, Nya, Nya, Nya, Nya, Nya, Nya, Nya, Nya, Nya, Nya, Nya, Nya, Nya, Nya, Nya, Nya, Nya, Nya, Nya, Nya, Nya, Nya, Nya, Nya, Nya, Nya, Nya, Nya, Nya, Nya, Nya, Nya, Nya, Nya, Nya, Nya, Nya, Nya, Nya, Nya, Nya, Nya, Nya, Nya, Nya, Nya, Nya, Nya, I'm going to take a short break and then go to the next area. Stadion 2 Neko-Kichi, I'm sorry. Nose, I'm going to show you the inside of the building. Stadion Ok, takk. Skål! Norske Norske Ja, det var det. Everybody's better."
The image shows a kitchen with a person standing and looking into the refrigerator. This action falls under the category of **Leisure Activities**.,2536,2558, Det blir så hemmeligt i skogen. Thank you. So it should be big. Maybe on the table. I don't know.
Washing dishes,2558,2566, All good? The building is now a public library. Nettokketsuji Norske Norske I thought that was part of the work.
Unclear,2566,2607, All good? The building is now a public library. Nettokketsuji Norske Norske I thought that was part of the work.
"The image provided shows a kitchen with various items on the counters and an island. Based on the visual cues, the most fitting category from the given options would be **Cooking**.

Here's why:

*   **Kitchen Environment:** The presence of a stove, countertops with food items, and what appears to be cooking utensils strongly suggests cooking activities.
*   **Items on Countertops:** There are various ingredients and tools that are typically used for preparing food.

While other activities might occur in a kitchen, the overall scene most directly points to cooking as the primary activity taking place or being prepared for.",2607,2676, All good? The building is now a public library. Nettokketsuji Norske Norske I thought that was part of the work.
"The provided image shows a person in a kitchen. The person is actively engaged in food preparation by handling ingredients on the kitchen counter and near the stove. Therefore, the most appropriate classification for this segment is **Cooking**.",2676,2862, I was there without the noise. Ik ga wel eens kijken wat er aan de hand is. The building is a
"The image shows a person in a kitchen, interacting with a toaster. This action falls under the category of **Cooking**.",2862,2863, This one.
Unclear,2863,2868, This one.
Walking,2868,2881," Okay. Okay. Okay. Okay, das ist gut. Nå er det en hel del av denne byggen som er på vej. Ok, you go ahead."
"The video segment shows people preparing food in a kitchen. Therefore, it falls into the **Cooking** category.",2881,2392," Okay. Okay. Okay. Okay, das ist gut. Nå er det en hel del av denne byggen som er på vej. Ok, you go ahead."
"The most fitting category for this segment is **Cooking**. The people in the image are gathered around a kitchen island with food and ingredients, suggesting they are preparing a meal.",2392,2436," there is actually curry way Oh, good. Good. Good. Good. Good. Good. Good. Good. Good. Good. Good. Good. Good. Good. Thank you. Wow. The current is not smart. It's you? Right. Right. I have to ask you if they have a spare storage room. That wasn't for me tonight. Thank you. No, no, no, no, no, no, no, no, no, no, no, no, no, no, no, no, no, no, no, no, no, no, no, no, no, no, no, no, no, no, no, no, no, no, no, no, no, no, no, no, no, no, no, no, no, no, no, no, no, no, no, no, no, no, no, no, no, no, no, no, no, no, no, no, no, no, no, no, no, no, no, no, no, no, no, no, no, no, no, no, no, no, no, no, no, no, no, no, no, no, no, no, no, no, no, no, no, no, no, no, no, no, no, no, no, no, no, no, no, no, no, no, no, no, no, no, no, no, no, no, no, no, no, no, no, no, no, no, no, no, no, no, no, no, no, no, no, no, no, no, no, no, no, no, no, no, no, no, no, no, no, no, no, no, no, no, no, no, no, no, no, no, no, no, no, no, no, no, no, no, no, no, no, no, no, no, no, no, no, no, no, no, no, no, no, no, no, no, no, no, no, no, no, no, no, no, no, no, no, no, no, no, no, no, no, no, no, no, no, no, no, no, no, no, no, no, no, no, no, no, no, LD, get the currency. I don't know. OD. See, this piece of currency is off the market. I think I'll just put whatever fits in. I'm trying to read. No. No. Oh. Yes. No. Yes. Somebody's going to have to explain. We have two in the building. yes"
"The scene depicts three individuals in a kitchen, actively engaged in preparing food. They are gathered around a central island, surrounded by ingredients and utensils. One person is chopping vegetables, another is arranging items on a tray, and the third is attending to something on the stovetop. This collective activity clearly falls under the category of **Cooking**.",2436,2437," there is actually curry way Oh, good. Good. Good. Good. Good. Good. Good. Good. Good. Good. Good. Good. Good. Good. Thank you. Wow. The current is not smart. It's you? Right. Right. I have to ask you if they have a spare storage room. That wasn't for me tonight. Thank you. No, no, no, no, no, no, no, no, no, no, no, no, no, no, no, no, no, no, no, no, no, no, no, no, no, no, no, no, no, no, no, no, no, no, no, no, no, no, no, no, no, no, no, no, no, no, no, no, no, no, no, no, no, no, no, no, no, no, no, no, no, no, no, no, no, no, no, no, no, no, no, no, no, no, no, no, no, no, no, no, no, no, no, no, no, no, no, no, no, no, no, no, no, no, no, no, no, no, no, no, no, no, no, no, no, no, no, no, no, no, no, no, no, no, no, no, no, no, no, no, no, no, no, no, no, no, no, no, no, no, no, no, no, no, no, no, no, no, no, no, no, no, no, no, no, no, no, no, no, no, no, no, no, no, no, no, no, no, no, no, no, no, no, no, no, no, no, no, no, no, no, no, no, no, no, no, no, no, no, no, no, no, no, no, no, no, no, no, no, no, no, no, no, no, no, no, no, no, no, no, no, no, no, no, no, no, no, no, no, no, no, no, no, no, no, no, no, no, no, no, no, LD, get the currency. I don't know. OD. See, this piece of currency is off the market. I think I'll just put whatever fits in. I'm trying to read. No. No. Oh. Yes. No. Yes. Somebody's going to have to explain. We have two in the building. yes"
"The person in the image appears to be **making coffee**. They are standing at the kitchen island, interacting with what looks like a coffee maker or coffee supplies.",2437,2441," there is actually curry way Oh, good. Good. Good. Good. Good. Good. Good. Good. Good. Good. Good. Good. Good. Good. Thank you. Wow. The current is not smart. It's you? Right. Right. I have to ask you if they have a spare storage room. That wasn't for me tonight. Thank you. No, no, no, no, no, no, no, no, no, no, no, no, no, no, no, no, no, no, no, no, no, no, no, no, no, no, no, no, no, no, no, no, no, no, no, no, no, no, no, no, no, no, no, no, no, no, no, no, no, no, no, no, no, no, no, no, no, no, no, no, no, no, no, no, no, no, no, no, no, no, no, no, no, no, no, no, no, no, no, no, no, no, no, no, no, no, no, no, no, no, no, no, no, no, no, no, no, no, no, no, no, no, no, no, no, no, no, no, no, no, no, no, no, no, no, no, no, no, no, no, no, no, no, no, no, no, no, no, no, no, no, no, no, no, no, no, no, no, no, no, no, no, no, no, no, no, no, no, no, no, no, no, no, no, no, no, no, no, no, no, no, no, no, no, no, no, no, no, no, no, no, no, no, no, no, no, no, no, no, no, no, no, no, no, no, no, no, no, no, no, no, no, no, no, no, no, no, no, no, no, no, no, no, no, no, no, no, no, no, no, no, no, no, no, no, no, no, no, no, no, no, LD, get the currency. I don't know. OD. See, this piece of currency is off the market. I think I'll just put whatever fits in. I'm trying to read. No. No. Oh. Yes. No. Yes. Somebody's going to have to explain. We have two in the building. yes"
"The segment is classified as **Cooking**. The video shows individuals preparing food on a kitchen island, with ingredients and cooking utensils visible.",2441,2442," there is actually curry way Oh, good. Good. Good. Good. Good. Good. Good. Good. Good. Good. Good. Good. Good. Good. Thank you. Wow. The current is not smart. It's you? Right. Right. I have to ask you if they have a spare storage room. That wasn't for me tonight. Thank you. No, no, no, no, no, no, no, no, no, no, no, no, no, no, no, no, no, no, no, no, no, no, no, no, no, no, no, no, no, no, no, no, no, no, no, no, no, no, no, no, no, no, no, no, no, no, no, no, no, no, no, no, no, no, no, no, no, no, no, no, no, no, no, no, no, no, no, no, no, no, no, no, no, no, no, no, no, no, no, no, no, no, no, no, no, no, no, no, no, no, no, no, no, no, no, no, no, no, no, no, no, no, no, no, no, no, no, no, no, no, no, no, no, no, no, no, no, no, no, no, no, no, no, no, no, no, no, no, no, no, no, no, no, no, no, no, no, no, no, no, no, no, no, no, no, no, no, no, no, no, no, no, no, no, no, no, no, no, no, no, no, no, no, no, no, no, no, no, no, no, no, no, no, no, no, no, no, no, no, no, no, no, no, no, no, no, no, no, no, no, no, no, no, no, no, no, no, no, no, no, no, no, no, no, no, no, no, no, no, no, no, no, no, no, no, no, no, no, no, no, no, LD, get the currency. I don't know. OD. See, this piece of currency is off the market. I think I'll just put whatever fits in. I'm trying to read. No. No. Oh. Yes. No. Yes. Somebody's going to have to explain. We have two in the building. yes"
Talking,2442,2443," there is actually curry way Oh, good. Good. Good. Good. Good. Good. Good. Good. Good. Good. Good. Good. Good. Good. Thank you. Wow. The current is not smart. It's you? Right. Right. I have to ask you if they have a spare storage room. That wasn't for me tonight. Thank you. No, no, no, no, no, no, no, no, no, no, no, no, no, no, no, no, no, no, no, no, no, no, no, no, no, no, no, no, no, no, no, no, no, no, no, no, no, no, no, no, no, no, no, no, no, no, no, no, no, no, no, no, no, no, no, no, no, no, no, no, no, no, no, no, no, no, no, no, no, no, no, no, no, no, no, no, no, no, no, no, no, no, no, no, no, no, no, no, no, no, no, no, no, no, no, no, no, no, no, no, no, no, no, no, no, no, no, no, no, no, no, no, no, no, no, no, no, no, no, no, no, no, no, no, no, no, no, no, no, no, no, no, no, no, no, no, no, no, no, no, no, no, no, no, no, no, no, no, no, no, no, no, no, no, no, no, no, no, no, no, no, no, no, no, no, no, no, no, no, no, no, no, no, no, no, no, no, no, no, no, no, no, no, no, no, no, no, no, no, no, no, no, no, no, no, no, no, no, no, no, no, no, no, no, no, no, no, no, no, no, no, no, no, no, no, no, no, no, no, no, no, LD, get the currency. I don't know. OD. See, this piece of currency is off the market. I think I'll just put whatever fits in. I'm trying to read. No. No. Oh. Yes. No. Yes. Somebody's going to have to explain. We have two in the building. yes"
Cooking,2443,2452," there is actually curry way Oh, good. Good. Good. Good. Good. Good. Good. Good. Good. Good. Good. Good. Good. Good. Thank you. Wow. The current is not smart. It's you? Right. Right. I have to ask you if they have a spare storage room. That wasn't for me tonight. Thank you. No, no, no, no, no, no, no, no, no, no, no, no, no, no, no, no, no, no, no, no, no, no, no, no, no, no, no, no, no, no, no, no, no, no, no, no, no, no, no, no, no, no, no, no, no, no, no, no, no, no, no, no, no, no, no, no, no, no, no, no, no, no, no, no, no, no, no, no, no, no, no, no, no, no, no, no, no, no, no, no, no, no, no, no, no, no, no, no, no, no, no, no, no, no, no, no, no, no, no, no, no, no, no, no, no, no, no, no, no, no, no, no, no, no, no, no, no, no, no, no, no, no, no, no, no, no, no, no, no, no, no, no, no, no, no, no, no, no, no, no, no, no, no, no, no, no, no, no, no, no, no, no, no, no, no, no, no, no, no, no, no, no, no, no, no, no, no, no, no, no, no, no, no, no, no, no, no, no, no, no, no, no, no, no, no, no, no, no, no, no, no, no, no, no, no, no, no, no, no, no, no, no, no, no, no, no, no, no, no, no, no, no, no, no, no, no, no, no, no, no, no, LD, get the currency. I don't know. OD. See, this piece of currency is off the market. I think I'll just put whatever fits in. I'm trying to read. No. No. Oh. Yes. No. Yes. Somebody's going to have to explain. We have two in the building. yes"
"The video segment shows individuals in a kitchen environment, engaged in activities such as preparing food and interacting. Based on the visual cues, the most fitting classification is **Cooking**.",2452,2473," there is actually curry way Oh, good. Good. Good. Good. Good. Good. Good. Good. Good. Good. Good. Good. Good. Good. Thank you. Wow. The current is not smart. It's you? Right. Right. I have to ask you if they have a spare storage room. That wasn't for me tonight. Thank you. No, no, no, no, no, no, no, no, no, no, no, no, no, no, no, no, no, no, no, no, no, no, no, no, no, no, no, no, no, no, no, no, no, no, no, no, no, no, no, no, no, no, no, no, no, no, no, no, no, no, no, no, no, no, no, no, no, no, no, no, no, no, no, no, no, no, no, no, no, no, no, no, no, no, no, no, no, no, no, no, no, no, no, no, no, no, no, no, no, no, no, no, no, no, no, no, no, no, no, no, no, no, no, no, no, no, no, no, no, no, no, no, no, no, no, no, no, no, no, no, no, no, no, no, no, no, no, no, no, no, no, no, no, no, no, no, no, no, no, no, no, no, no, no, no, no, no, no, no, no, no, no, no, no, no, no, no, no, no, no, no, no, no, no, no, no, no, no, no, no, no, no, no, no, no, no, no, no, no, no, no, no, no, no, no, no, no, no, no, no, no, no, no, no, no, no, no, no, no, no, no, no, no, no, no, no, no, no, no, no, no, no, no, no, no, no, no, no, no, no, no, LD, get the currency. I don't know. OD. See, this piece of currency is off the market. I think I'll just put whatever fits in. I'm trying to read. No. No. Oh. Yes. No. Yes. Somebody's going to have to explain. We have two in the building. yes"
Cooking,2473,2475,
"The provided video segment shows people in a kitchen, with one person actively preparing food on a counter and another person observing or assisting. The overall context suggests a culinary activity.

Therefore, the most appropriate classification for this segment is **Cooking**.",2475,2496," Yeah, I know."
Cooking,2496,2501, You can move it here.
"The video segment shows a group of people in a kitchen preparing food. They are chopping vegetables, assembling food on trays, and cooking. Therefore, the most appropriate classification for this segment is **Cooking**.",2501,3100," I can help you. You can move it here, but I cannot... Yes, let's do it. You need the cutting board still? Stefan, you need the second cutting board still? Can we make some space here? Because this is very... Make sure this is all... Just hold it. Just hold it. Just trousers. I'm wearing disposables. Black disposables for a reason can i get an apron for songs like"
"The most fitting category for this segment is **Cooking**.

The video shows multiple people in a kitchen environment, actively preparing food. There are ingredients on the counter, cooking utensils, and what appear to be small pastries or food items being handled. The overall scene depicts the process of preparing a meal.",3100,181," Sorry, you need to boot both because this is going to be very no no I only think AI? what does AI stand for? artificial intelligence who wins? You I'm gonna to put them in the front. I think now, we start by cooking a little bit of oil before we put it in. And use the bottom. More water? More water. I'm trying to chill with the chicken."
Cooking,181,310," Just to get it. Hey, how long? Because I think we need a few minutes for this as well. For, yeah, but this is like, if the ramen is hot then it's... We need Yeah, but I'm not sure sure i don't know yeah he's not here all right you think i couldn't you close yeah I would like now I just have"
Cooking,310,312, I may have missed. Ha ha ha ha ha ha ha ha ha ha ha ha ha ha ha ha ha ha ha ha ha ha ha ha ha ha ha ha ha ha ha ha ha ha ha ha ha ha ha ha ha ha ha ha ha ha ha ha ha ha ha ha ha ha ha ha ha ha ha ha ha ha ha ha ha ha ha ha ha ha ha ha ha ha ha ha ha ha ha ha ha ha ha ha ha ha ha ha ha ha ha ha ha ha ha ha ha ha ha ha ha ha ha ha ha ha ha ha ha ha ha ha ha ha ha ha ha ha ha ha ha ha ha ha ha ha ha ha ha ha ha ha ha ha ha ha ha ha ha ha ha ha ha ha ha ha ha ha ha ha ha ha ha ha ha ha ha ha ha ha ha ha ha ha ha ha ha ha ha ha ha ha ha ha ha ha ha ha ha ha ha ha ha ha ha ha ha ha ha ha ha ha ha ha ha ha ha ha ha ha ha ha ha ha ha ha ha ha ha ha ha ha ha ha ha ha ha ha ha ha ha ha ha ha ha ha ha ha ha ha ha ha ha ha ha ha ha ha ha ha ha ha ha ha ha ha ha ha ha ha ha ha ha ha ha ha ha ha ha ha ha ha ha ha ha ha ha ha ha ha ha ha ha ha ha ha ha ha ha ha ha ha ha ha ha ha ha ha ha ha ha ha ha ha ha ha ha ha ha ha ha ha ha ha ha ha ha ha ha ha ha ha ha ha ha ha ha ha ha ha ha ha ha ha ha ha ha ha ha ha ha ha ha ha ha ha ha ha ha ha ha ha ha ha ha ha ha ha ha ha ha ha ha ha ha ha ha ha ha ha ha ha ha ha ha ha ha ha ha ha ha ha ha ha ha ha ha ha ha ha ha ha ha ha ha ha ha ha ha ha ha ha ha ha ha ha ha ha ha ha ha ha ha ha ha ha ha ha ha ha ha ha ha ha ha ha ha ha ha ha ha ha ha ha ha ha ha ha ha ha ha ha ha ha ha ha ha ha ha ha ha ha ha ha It's a place of life and I...
"The most fitting category for this segment is **Cooking**.

Here's why:
* **Visual Evidence:** The people in the image are in a kitchen, with ingredients like chopped vegetables on the counter and cooking utensils visible. One person appears to be holding food and the other is near the stovetop. This strongly suggests they are preparing a meal.",312,555, I may have missed. Ha ha ha ha ha ha ha ha ha ha ha ha ha ha ha ha ha ha ha ha ha ha ha ha ha ha ha ha ha ha ha ha ha ha ha ha ha ha ha ha ha ha ha ha ha ha ha ha ha ha ha ha ha ha ha ha ha ha ha ha ha ha ha ha ha ha ha ha ha ha ha ha ha ha ha ha ha ha ha ha ha ha ha ha ha ha ha ha ha ha ha ha ha ha ha ha ha ha ha ha ha ha ha ha ha ha ha ha ha ha ha ha ha ha ha ha ha ha ha ha ha ha ha ha ha ha ha ha ha ha ha ha ha ha ha ha ha ha ha ha ha ha ha ha ha ha ha ha ha ha ha ha ha ha ha ha ha ha ha ha ha ha ha ha ha ha ha ha ha ha ha ha ha ha ha ha ha ha ha ha ha ha ha ha ha ha ha ha ha ha ha ha ha ha ha ha ha ha ha ha ha ha ha ha ha ha ha ha ha ha ha ha ha ha ha ha ha ha ha ha ha ha ha ha ha ha ha ha ha ha ha ha ha ha ha ha ha ha ha ha ha ha ha ha ha ha ha ha ha ha ha ha ha ha ha ha ha ha ha ha ha ha ha ha ha ha ha ha ha ha ha ha ha ha ha ha ha ha ha ha ha ha ha ha ha ha ha ha ha ha ha ha ha ha ha ha ha ha ha ha ha ha ha ha ha ha ha ha ha ha ha ha ha ha ha ha ha ha ha ha ha ha ha ha ha ha ha ha ha ha ha ha ha ha ha ha ha ha ha ha ha ha ha ha ha ha ha ha ha ha ha ha ha ha ha ha ha ha ha ha ha ha ha ha ha ha ha ha ha ha ha ha ha ha ha ha ha ha ha ha ha ha ha ha ha ha ha ha ha ha ha ha ha ha ha ha ha ha ha ha ha ha ha ha ha ha ha ha ha ha ha ha ha ha ha ha ha ha ha ha ha ha ha ha ha ha ha ha ha ha ha ha ha ha ha ha ha ha ha ha ha ha ha ha It's a place of life and I...
Cooking,555,557,
Cooking,557,566,
Cooking,566,584,
Cooking,584,1094," The moon is floating. Kukkete, kukkete, kukkete, kukkete, kukkete, kukkete, kukkete, kukkete, kukkete, kukkete, kukkete, kukkete, kukkete, kukkete, kukkete, kukkete, kukkete, kukkete, kukkete, kukkete, kukkete, kukkete, kukkete, kukkete, kukkete, kukkete, kukkete, kukkete, kukkete, kukkete, kukkete, kukkete, kukkete, kukkete, kukkete, kukkete, kukkete, kukkete, kukkete, kukkete, kukkete, kukkete, kukkete, kukkete, kukkete, kukkete, kukkete, kukkete, kukkete, kukkete, kukkete, kukkete, kukkete, kukkete, kukkete, kukkete, kukkete, kukkete, kukkete, kukkete, kukkete, kukkete, kukkete, kukkete, kukkete, kukkete, kukkete, kukkete, kukkete, kukkete, kukkete, kukkete, kukkete, kukkete, kukkete, kukkete, kukkete, kukkete, kukkete, kukkete, kukkete, kukkete, kukkete, kukkete, kukkete, kukkete, kukkete, kukkete, kukkete I'm going to start making the happy quiz for tomorrow. Okay, send this to the room. What time is your order? 1.30? 1.00. I'll check with Stefan. He's in charge of this operation. Okay. If you have the red light when it's off, it reaches the temperature. Leave it, leave it. to heat it up. I said leave it to heat it up. When the red light is off, it reaches the temperature. Leave it, leave it. Leave it at home."
Cooking,1094,1105," potatoes with broccoli 300 No, no, no So it's a We put the broccoli in the dirty because the cauliflower is to cook Yeah It doesn't paint That's the thing Broccoli is also fine 6? Yeah Yeah So we don't do white I want to do white for you No We can just have normal white Yeah, normal Yeah, we bought some red wine I got the red wine yeah yeah from this one then we move into one bottle I guess this one this is the leftover from the risotto so we drink can drink it again? Probably, but I'll ask Lou. I like it because in case he needs more... I'll ask him and then we can bring it to the table. I'm not going to. Why is this gone? Probably a new one. Not enough. Hey boss! come and check the potatoes. We have to decide how firmly we want them to be. Should they be al dente or should they be... Well, because it's Indian, I think it should be cut mashy. But I think it's... let's put in the bread now. When the bread is ready, we just make it ready. Right? When the bread is ready, we just make it ready. Yeah. We pretend it's ready. Yeah. We do that. Get a grid to the ring. Get it to the blue. Get right to the right. When bread is ready, we just make it ready. Mm-hmm. Ag. Agree? For a protocol? Because it needs a bit more time. It is a different type of bread it seems to me. A different type of potatoes. Potatoes are a little bit else, yes. Probably not the potatoes that should be used. A little bit more taste maybe more like fried chip potatoes"
**Cooking**,1105,1333," potatoes with broccoli 300 No, no, no So it's a We put the broccoli in the dirty because the cauliflower is to cook Yeah It doesn't paint That's the thing Broccoli is also fine 6? Yeah Yeah So we don't do white I want to do white for you No We can just have normal white Yeah, normal Yeah, we bought some red wine I got the red wine yeah yeah from this one then we move into one bottle I guess this one this is the leftover from the risotto so we drink can drink it again? Probably, but I'll ask Lou. I like it because in case he needs more... I'll ask him and then we can bring it to the table. I'm not going to. Why is this gone? Probably a new one. Not enough. Hey boss! come and check the potatoes. We have to decide how firmly we want them to be. Should they be al dente or should they be... Well, because it's Indian, I think it should be cut mashy. But I think it's... let's put in the bread now. When the bread is ready, we just make it ready. Right? When the bread is ready, we just make it ready. Yeah. We pretend it's ready. Yeah. We do that. Get a grid to the ring. Get it to the blue. Get right to the right. When bread is ready, we just make it ready. Mm-hmm. Ag. Agree? For a protocol? Because it needs a bit more time. It is a different type of bread it seems to me. A different type of potatoes. Potatoes are a little bit else, yes. Probably not the potatoes that should be used. A little bit more taste maybe more like fried chip potatoes"
